subreddit,title,text,score,num_comments,created,keyword
BabyBumps,I compiled every piece of morning sickness advice. Please enjoy.,"Congratulations! You're pregnant. You know you are pregnant because all of the healthy foods you planned to eat make you want to vomit. And also, there's cheeto dust on your hands. 

Here are some things to help with your nausea. 

Eat something small as soon as you wake up, although you were almost certainly woken by nausea so it is probably too late. Also, only eat simple bland foods that you can handle, like crackers. But don't eat any foods that will spike your blood sugar, like crackers. And don't go on an empty stomach. 

Avoid coffee, which can make your nausea worse. Instead, take unisom+B6 twice a day, because you can't be nauseous when you are unconscious. Also, take it on the empty stomach you could not possible tolerate.

Avoid strong smells, such as peppermint, ginger and the god-awful, unmistakable vitamin -smell, but always take your vitamins. Also, peppermint and ginger can help with nausea, so keep some on hand at all times. 

You can try sucking on hard candy during the day, it PROBABLY won't cause gestational diabetes, but you know Myaleigh didn't have any refined carbs during her pregnancy and her son Dylaleigh just got in to baby Harvard, so... 

Also, we know you're trying to avoid letting people know that you're pregnant, so wear these VERY VISABLE and hideous Sea Bands. Just tell people you just came back from jazzercise. It will help that you're already sweaty.

Drink at least a gallon of water a day, but only take small sips. Or better yet, ice chips. Have one gallon a day of ice chips. One chip a minute for 24 hours a day, that sounds about right. And also, get plenty of sleep while marathon ice chipping. Don't worry, your AM sleeping pill should help with that. 

And if things get really bad, you can always get stronger meds like zofran. Your mother in law definitely won't say things like, ""well, in my day, we weren't allowed to take ANYTHING for nausea. We just dealt with it..."" 

THANKS, SHARON

But seriously, you're probably just feeling a little stressed. Just lie down for a minute, you'll be fine. Lying flat definitely won't make you immediately vomit from the acid rushing up your esophagus.

Happy Magical Pregnancy!




Okay, trolling over. Thank you for indulging in my rant. I'm at 8w with twins and I might die. 

Now excuse me, i missed like 8 ice chips while writing this.

",1506,170,2019-02-19,stress during pregnancy
BabyBumps,27 weeks. What’s the best ways you’ve found to relax and de-stress. Especially if you feel guilty about stressing during pregnancy.,"So for context, my husband and I are currently selling our home and I’m working on my masters (until the baby arrives). I’m a natural worrier, so of course I’m stressed during this time. He keeps saying everything will be fine, and my family just keeps saying “don’t worry, just focus on the baby”. None of that is helping because then I worry that the baby is feeling my stress and anxieties. So what’s the best way, if you’ve been stressed and pregnant, to relax and not be anxious?",7,8,2019-06-07,stress during pregnancy
BabyBumps,WARNING! RANT! Coworker(F) giving me a hard time after finding out about my pregnancy!,"A little bit of background to this. I have a coworker that I have worked with for 3 years now. I work for a small office, only 5 employees and we share an office together. We've been involved in each other's lives and do things outside of work since I started working here, and have created mutual friends along with that, so she feels that she can give unsolicited advice CONSTANTLY. 

I started a weight loss journey in Jan 2017 and lost 50 pounds and was successful with my goals. Maintained my weight through my 1 1/2 year engagement up to my wedding. During that time, she made comments on my weight loss and how I was trying to starve myself and try to not get ""too skinny."" I looked at that as a little bit of jealousy since she is over weight and ""tries"" to diet and then eats constantly through out the work day. 

After just getting married in December, we have found out we are pregnant with baby #1, due is September. It was not planned, but we were for sure not preventing, and was not expecting it to happen so soon. The moment she found out she started commenting on the food I would eat. Mind you, morning sickness has not been kind. Especially in the late afternoon and evening, so I have been eating little snacks throughout my day. I was addicted to coffee before this and the fact I couldn't drink as much and then realizing morning sickness wasn't allowing me to keep it down has not helped with my demeanor either. She would constantly say that what snacks I am eating isn't baby friendly, and that I need to give baby the food it needs and eat more. This is obviously all new to me. I've never been pregnant before. The fact you fight the urge to throw up every time you yawn is a mental struggle in itself and the fact that you yawn constantly cause you're tired from growing a human! 

Recently our boss called in to ask how I was doing, her response as she starred at me working, **""She's just wallowing in self-pity, she needs to get over it, cause this is her life now.""** She gets off the phone and look at her and say **""Was that about me?""** She says yes and how she thinks I'm being a little dramatic with my feelings. Hormone Beast then unleashes. I then say **""Have you ever been pregnant before?""** She responds no, to which I reply **""THEN SHUT THE F\*\*K UP.""** My best friend believes that it's jealousy as she lives with her boyfriend of 12 years and is no where near where she wanted to be at this point. She has admitted in the past that she thinks life sucks cause everyone around her got married and is having babies and she doesn't see her BF giving that to her. I'M SORRY BUT THAT IS NOT MY FAULT. I firmly believe that if there is something about your life that you don't like, do something about it. You hold your destiny. I am now leaving this job for a part time position at another company to help give me a less stressful pregnancy and easier transition after baby is born, and I don't see the attitude and judgement ending even until my last day. 

&#x200B;

Thanks for letting me vent. I just know there are ladies here that have probably been in this situation and I hate how some women can't be supportive towards their fellow women out there. Rant over. ",511,145,2019-02-19,stress during pregnancy
BabyBumps,C-Sections: Lessons Learned and FYI," 

I made this \[comment in this thread\]([https://www.reddit.com/r/BabyBumps/comments/ax9jsq/one\_tip\_from\_a\_new\_dad\_hope\_for\_the\_best\_plan\_for/ehsc0w7/?context=3](https://www.reddit.com/r/BabyBumps/comments/ax9jsq/one_tip_from_a_new_dad_hope_for_the_best_plan_for/ehsc0w7/?context=3)), and many people told me they found it useful, and wish they had known before their unplanned or emergency c-sections, so I figured maybe I should make my own post to reach more people! My c-section saved my life and the life of my child. Because of that first c-section we are both alive today, and I am now pregnant with my second. This new baby will be delivered by scheduled c-section in August. I also hate seeing new moms on here feeling guilty about having a c-section. So here I am as a pro SURVIVING BIRTH angry ranting mom. I am not a medical professional, though I have many in my family, this is all just based on my experience. 

&#x200B;

I really didn't think I'd end up with a c-section. Not that I had any qualms about them, just that my family history is great at giving birth to big babies with no complications. No one I’m blood related to has had any birth complications AT ALL (this is going back at least three generations too), with many of these babies over 8lbs. We knew my baby was big, but again, I wasn’t that concerned. I had been a big baby myself (8lbs10oz), and my mom delivered me easily. Well, thanks to my husband, my big baby also has a really big head (90th percentile) which was too big, and she got stuck. Hadn’t moved down the birth canal AT ALL after two hours of pushing kind of stuck. So even me, with my family history of AMAZING births, low risk pregnancy, I needed a c-section. I’ve never felt any guilt or shame over it, as I clearly needed it. It probably also helped that the c-section itself was super positive, and all my doctors were really kind. My kid was not in distress, just stuck, so it wasn’t a stressful event. Though without the c-section we both would have eventually died, since there was no way she was coming out vaginally. I do want to note that my incision got infected a week postpartum and developed a seroma (pocket of fluid and blood which burst), so my recovery was a bit worse than average, which will affect some of my advice and experience. I'm also a redhead which apparently means I feel more pain? The nurses and doctors also told me that since I went all the way through labour first, I also had a harder recovery. As I’ve only had the one birth, I can’t say, but it was a pretty hard recovery! Anyways, here are my tips and lessons learned from my experience as an unplanned c-section mama:

&#x200B;

\- Actually I give everyone this advice, but make sure your hospital bag has room for your “street clothes.” My labour bag did not, and since we had to switch rooms a couple times (from labour to OR to recovery to postpartum) my shoes got misplaced. Luckily we found them again, but lesson learned! Also I got so swollen while in the hospital that I couldn’t even wear them home, so bring loose fitting shoes. 

&#x200B;

\- Read about c-section experiences before birth. I had done this, and so when they were tugging the baby out, which you REALLY feel (though no pain) it's SO weird. You really feel yanked about! I think it would have been quite scary if I hadn't known about it.

&#x200B;

\- I have heard some people feel shocked at the amount of people in the room during the surgery. Hopefully someone who knows more specifics can chime in, but there’s a good number of people in the OR during surgery, more if the baby is in distress. I was pretty out of it by this point so I didn't really care. 

&#x200B;

\- I also recommend getting “the first family picture” during surgery, if possible. I love that photo! 

&#x200B;

\- My surgeon also did delayed cord clamping and we did skin to skin after they examined her. There are ways to bring in some of your “birth plan” in a c-section. Always worth asking! Obviously in a emergency c-section they would not do these things. 

&#x200B;

\- Also, many people, myself included, get the shakes after surgery, and feel so so cold. I don't remember the reason, but it's super common. Again I probably would have been frightened if I hadn't heard about it. 

&#x200B;

\- You’ll be cathed, so when you stand up after a c-section, you’ll drip blood all over the floor, since it will run down the cath tube. I haven’t confirmed this with other c-section mamas, but it was an experience. Luckily the nurses knew it was going to happen, and were very reassuring that it was no big deal. Happened every time I stood up until they took the cath out. 

&#x200B;

\- Laughing will hurt SO MUCH, so don’t watch any comedy shows for a while, and if you’re loading shows onto a tablet for recovery, NO COMEDY. Also tell any comedians in your life to only make dad jokes, as chuckling and eye rolling does not hurt. 

&#x200B;

\- Bring slippers or flip flops to the hospital that you don't need to bend down to put on. I did not do this, so if there wasn't anyone around to help me, I went barefoot, which you don't really want to do in the hospital... I also wore my slippers for a couple hours once because I couldn't get them off myself, and didn't want to bug the nurses. Lesson learned! Also get ones you don’t mind if you bleed on them…

&#x200B;

\- They want to make sure your bowels work after the c-section, which can cause issues with that, so they encourage the taking of laxatives after surgery. Well I had never taken laxatives before, and it turns out I am really sensitive to them, and the dose they gave, gave me insane diarrhea for 3 days. So maybe try out lax-a-day (which is the one they gave me) before birth…

&#x200B;

\- You’ll have a longer hospital stay with a c-section, so I suggest everyone prepares as if they are going to spend 2-3 days in the hospital. 

&#x200B;

\- A c-section can cause delays in your milk coming in. Super normal, but a bit annoying. We gave her formula and the tiny drops we managed to pump until my milk came in, I think 4 or 5 days postpartum. We had a lot of troubles getting breastfeeding going even after my milk came in, so if you have access to LCs, take advantage of them! And if you get a bad one (they do exist) try another one. Also, this isn’t just for c-sections, breastfeeding should NOT hurt. Sure, it may be uncomfortable, but if it’s excruciating, stop and get help. DO NOT PUSH THROUGH THE PAIN, you can injure yourself. My daughter had a tongue tie which needed to be snipped, and then we needed to teach her to suckle instead of chomping down/nibbling action. The help we got from the LCs was invaluable! I had one nurse try to bully me into breastfeeding at the hospital, saying I needed to push through the pain, luckily at that point I was so battered I was refusing to put her on until I healed (which the hospital LCs supported). Because I let myself heal, and got help early, we were able to get back to breastfeeding successfully (with a lot of work, was not simple journey). Not that I judge anyone who chooses not to breastfeed, or can’t breastfeed. I’m a firm supporter of the fed is best movement. Formula is amazing stuff, and I am so grateful that it was available to nourish my child before I could, and that it was available to nourish her if breastfeeding didn't work. 

&#x200B;

\- Read up about wound care and what infection looks like. My incision got infected and developed a seroma. I got medical attention right away, and so nothing became serious (though it certainly FELT serious when the seroma burst.) Also if you aren't sure, and are worried about your incision (or your stitches if you've had a vaginal birth) go to the doctor. Early intervention is best. I know a lot of c-section mamas, but I don’t know anyone else who had these issues happen to them, so it’s not common. 

&#x200B;

\- Everyone says this, but TAKE YOUR MEDS. Don't be a hero, take your meds. You’re already a fucking hero getting sliced open to bring your baby safely into the world. They wouldn't give you meds that aren't safe in breastfeeding (and if you're unsure about this, ask) so take your meds. Because of the infection I was on the good stuff for longer than most, and I have no regrets. 

&#x200B;

\- If you have a long drive home, ask for some extra meds. You’re going to feel EVERY BUMP IN THE ROAD. My ride home was really short, but it was still so painful. This time around, I'm going to be asking for some of the good meds even for my short ride home. 

&#x200B;

\- Like vaginal and complication free births, the more you can do before, will help after. Our house was really clean, and we had some freezer meals prepared, which helped so much. I couldn't do much of anything for the first two weeks (made worse by the infection) so my husband had to do a lot, and it made life easier. Which when you just had major surgery and you're taking care of a newborn, anything that makes life easier is ESSENTIAL.

&#x200B;

\- Have some high waisted underwear on hand. Do you know the seam of EVERYTHING is right where your incision is going to be? My mom got me the ugliest granny panties ever, not great for the self esteem, but they were essential for the first while. (Until my seroma burst and I had a big bandage in front of my incision to catch the blood and fluid, so I could wear my normal underwear with that, but again, that doesn’t happen to most people.)

&#x200B;

\- I found a changing table essential. I haven’t confirmed this with other c-section mamas, so this might just be me, but even bending over the bed or couch to change a diaper would have been impossible. Our changing table was just a mat on a dresser, so nothing fancy, but it was essential for the first couple weeks, and I used it for months. I'd love to hear if other c-section mamas found this, as I've only heard from non-c-section mamas how unnecessary changing tables are..  

&#x200B;

\- I actually recommend this piece of advice for all new moms, not just us c-section mamas, but have some less mighty pads on hand. Yes, have the super mighty long pads on hand too, but I found as my bleeding slowed, and I didn’t need them anymore, I found them uncomfortable. Because of the c-section (and it was terribly cold and snowy out), I had to send other people to the store to get less mighty pads, which was a pain (I prefer to pick out my own.) Where I am (Alberta, Canada) they don’t recommend you use adult diapers, since the amount of blood in a pad can show if something is going wrong, but I still think this advice fits for people who use adult diapers. I can imagine those get really uncomfortable when you are only bleeding a bit. 

&#x200B;

\- Ask for help and accept help. You'll need it, and your husband will need it. My family is amazing, and were SO helpful after birth, they are all complete justYES's. My husband's family was not, but that’s a long story and more suited to r/justnoMIL. For my scheduled c-section in August, I’ve already been lining up people to help, especially now that I have a toddler to care for as well. 

&#x200B;

\- And the biggest thing, don't let ANYONE shame you for needing a c-section. It's insane how so many people think that if all I did was push harder, she would have come out. I pushed hard for two fucking hours, she was firmly stuck, but if she was making slow progress I would have kept pushing. Besides, if you look into the not so distant past, maternal death rates show why we have these AMAZING AND LIFE SAVING procedures. I didn't miss out of an vaginal birth, I missed out on dying.

\- And the argument that a c-section gets in the way of bonding is complete BULLSHIT. First of all, my baby and I are incredibly bonded, having a different arrival to the world did NOT affect that at all. Second, what does that say about fathers? Adoptive parents? They don’t give birth, are you saying that if they won’t be able to bond? What about NICU parents? They often don’t get to even HOLD their children for days, are they less bonded? Fuck no. 

\- And the attitude “c-sections are the easy way out” seriously pisses me off. Trust me, if there was an easy way out, I would fucking take it, but a c-section is NOT IT. Labour is hard, but at least in my experience, recovery from a c-section is WAY harder. I couldn’t put my own shoes on for 10 DAYS. I won’t be allowed to lift my toddler for 6 weeks. Does that sound like the easy way out? Again I don’t regret my c-section, and am looking forward to skipping labour this time around, but a c-section is NOT the easy way out. 

&#x200B;

I'd love to hear from more c-section mamas, what did you wish you had known before your c-section? What were your essentials after birth? 

&#x200B;

And I'd love to hear from any FTMs or S+TMS with any questions regarding c-sections. I'll try to answer them in any way I can. ",161,113,2019-03-25,stress during pregnancy
BabyBumps,Had my baby after very stressful pregnancy!,"On Wednesday I was inducted at 38 weeks and had my wonderful baby Theodore at 1:12 am on Thursday, at 20"" long and 7 lbs 4 oz. 

My pregnancy was smooth sailing until around halfway through, in early-mid June I had an ob/gyn appointment and complained that I was very constipated and was starting to have pain because of it. I wasn't worried at this point and was told to take colace, which I did. About a week later I still hadn't pooped and started throwing up everything that I ate. I was taking so much colace, prune juice, fiber bisuits, tried two enemas, but nothing helped. I stopped being able to sleep because the pain was so bad. After 3 days of not holding down food I stopped being able to hold down any liquids either. I called my obgyn and was advised to go to the ER to be evaluated and get fluids. 

I went to the ER and was told the nausea and vomiting were just morning sickness (even though I hadn't had any in two months) and that constipation was normal in pregnancy, just take some colace. I was given fluids and released. The next day I was throwing up about every half hour, went back to the ER, was given more fluids and told I had hyperemisis gravidarum. I knew something was very wrong at this point but the ER doctor just brushed off all my concerns.

The next day, after being unable to hold down food for almost a week and liquids for 3 days, I started vomiting up brown smelly liquid about every 15 minutes. I knew there was nothing in my stomach and quickly google diagnosed myself as having fecal vomiting (stuff in the intestines backflowing into my stomach) and a bowel obstruction. My husband called the ob and the ob called ahead to the ER to tell them this was not normal and I needed to see a GI specialist. 

This time I was taken seriously and had an x-ray done, which showed I might have a bowel obstruction. Then a CT scan which showed I definitely had a bowel obstruction. The GI surgeon came to speak to me and told me the reason my intestines hadn't ruptured yet was because the fecal vomiting was relieving pressure on them, but the large intestine was stretched beyond repair and would need to be removed. If I didn't have surgery ASAP my intestines would end up rupturing, or dying as the blood flow was cut off in them because of the swelling. I would wake up from surgery with an ileostomy (similar to a colostomy). The anesthesia could induce labor in which case my baby at 21w6d would not survive. I'm already afraid of surgery and the surgeon had never operated on a pregnant woman before, so I was terrified heading into surgery but knew I would die without it. 

I was in surgery for 5 hours, and woke up to be told that the obstruction was caused by a large tumor. The ileostomy bag was very disheartening to me but I've since adjusted to it well enough. The cancer cells had started to spread outside the colon and onto the lymph nodes, and I would need treatment. It was the worst day of my life, it felt like my world was crashing down around me. The only good news was the baby made it through the surgery just fine. 

We didn't initially think I could do chemo during pregnancy, but after meeting with several maternal fetal medicine specialists it turns out chemo is fairly safe during pregnancy because the placenta does a pretty good job protecting the fetus. 

I completed 5 rounds of chemo during pregnancy (7 more to go) and had constant doctor's appointments to do non-stress tests and growth ultrasounds to make sure baby was doing well, all of which he did great on. My weight was a big concern since I'd been at my pre-pregnancy weight still and then lost 15 lbs during the time I wasn't eating and during hospitalization. It took me the rest of the pregnancy to gain that back. 

My doctors decided to induce me at 38 weeks to fit into my chemo schedule and make sure I didn't have to stop treatment for too long. I was eager to have my baby because I was so exhausted of dealing with late pregnancy, the chemo side effects, and working full time as well. 

So on Wednesday I went in to be induced, 16 hours after starting pitocin I delivered my beautiful baby boy. I had an epidural which was great, my first baby I went into labor on my own and it progressed so quickly I wasn't able to get an epidural and honestly thought this must feel like what dying from a gut wound feels like it was so painful. With the epidural I could still feel contractions but not pain which was great. It was very weird being basically temporarily paralyzed from the waist done though. When I was transferred from the labor to the recovery room I tried pulling myself onto the stretcher with my legs dragging behind me and my husband told me I looked like a dying animal. 

I'm not able to breastfeed because the chemo medicines/poisons transfer into the breastmilk but bottle feeding has been nice because my husband and I can take shifts at night staying up with the baby so I can actually have a decent stretch of sleep. We're so happy to have home with us after such a stressful pregnancy and he is such a cute little guy. My husband and daughter and I are all in love with him. :)

TL;DR: Had my baby Theodore after finding out halfway through pregnancy I needed my colon removed and would have an ostomy bag instead, and being diagnosed with cancer and starting chemo.",389,53,2019-10-22,stress during pregnancy
