AskDocs,"This study says that early onset cataracts has a marked increase in cancer rates, I was born with cataracts-is this applicable to me too or are congenital/pediatric cataracts different given their unusual etiology?","https://www.ncbi.nlm.nih.gov/pmc/articles/PMC4317801/

25 male. Found I had bilateral congenital cataracts at 4 lamellar type. Now the article states early onset cataracts as a major risk factor for other issues, even in 20 year olds, however with cataracts like mine that most likely are purely genetic etc is that applicable as well? I’m just wondering as the article recommends cancer screening early but at the same time I know congenital pediatric cataracts are often seen as a whole different beast to age related.",2,2,2020-12-11,born early,81,,,,,,,,,
BabyBumps,Need advice from women with similar experiences. I’ve option of c-section or vaginal delivery. Can you help me possibly weigh in on this? (Info in post),"Hi all,

TLDR: had third degree tears and shoulder dystocia first time. Am 5’4 , baby was not even huge. Have the option for a c section.

I need some outside perspective on this issue. I know each pregnancy and delivery is different and anything can happen. But I just want to few out the probability of what is better for me based on my previous experience.

I am pregnant for the second time and due date is end of May. My first pregnancy was kind of traumatic for me. I’m 5’4 and my baby was 3.4 kgs (not even in the 50th percentile). Labour was kind of painful but that wasn’t the issue. I needed, from three nurses, manual maneuvering when pushing baby out. It seemed that my pelvic area was not big enough - baby’s shoulders were stuck (shoulder dystocia). I ended up with third degree tears and after a week, abscess between vagina and anal area. That was drained after 40 days. Had mastitis and fever during that whole thing. Recovery was long and I cannot thing about it positively but now, I barely remember it. It’s now almost three years this May since my first pregnancy. This pregnancy, I noticed that whenever my husband and I had sex, my downstairs was clamp up painfully and I would need a day to feel normal again. I insisted on a generous amount of lubricant every time since then. I don’t know if it’s the hormones that are making the walls dry and more fibrous or what. I know tissue is not the same because of the the tears but I did not have this problem when we had sex before I got pregnant. So now I’m concerned how the tissue would stretch for the baby coming out if I’m having this issue with just sex. I been talking to my doctor about the possibility of having a c section for the past three, four meetings. I want to go for normal but I do not want an equivalent or a worse experience than what I had before. I also read that tears and infection after pregnancy can put you at risk for fistula which is a chronic and common issue (my doctor says that she hasn’t seen this issue in her two decades of experience but you never know...). She is being very diplomatic and not really helping in making my decision. She says that My pelvic area would be stretched out so even if this baby is big, I can push her out. She also said that because of my third degree tears, I would tear at a minimum...Pls help! I’m a little confused. I want a c section because I don’t want to end with a long recovery and double the scar and fibrous tissue down there and possibly chronic conditions. But then do need a c section? Ugh. Just weighing the pros and cons.",2,13,2020-05-03,c-section delivery,489,,,,,,,,,
AskDocs,Help dealing with tramadol withdrawal please,"33F. Main issues Fibromyalgia, IBS, chronic acid reflux, chronic depression, Borderline PD. Current medication: Tramadol 50mg (dose varied, see below), Oramorph 2.5ml-5ml as needed (not every day use), Paracetamol 1000mg 4 times daily, trazodone 300mg at night, omeprazole 20mg at night, OTC vitamin D supplement one per day (prior diagnosed deficient, prescribed highed dose for a couple of months, now taking OFC dose to maintain). I also have the mirena coil.


My main situation is that I'm planning to start a family, but to do so I need to come off most of my medications - I was advised on this at the hospital at the gynae clinic as well as monitoring with my GP. So far I have come off Gabapentin entirely (was 300mg 3 times daily) and have been going down by 50mg per week with tramadol.   I was taking both for 5 years or more for the chronic pain, the rise in pain coming off them is cery difficult but I am trying to cope so I have the best chance when ready to attempt pregnancy


I'm currently in the last stages of tramadol, only on 1-2 50mg pills over the day. I was on 8 per day across 4 doses. I'm trying to go down from 2 to 1, but I'm finding the withdrawal much much worse and on the verge of unbearable.


The worst part is the feeling in the stomach, ""pangs"", or like a dull fizzing sensation on the edge of being pain which grows worse until it is unbearable and I move which makes it better for 10-30 seconds before it gets awful again. As you can imagine this is making sleep impossible. The Trazodone I take is usually highly sedating at night to help me sleep but it took well over an hour more than usual last night, and that was after I had to give in and take the 2nd tramadol for the day and 2.5ml morphine because the pain was also unbearable.


I don't want to use much morphine at all, I use the bare minimum when my pain is unbearable to cope with in other ways (heat packs, rest, etc).


I'm so close to being off the tramadol, and have coped thus far with reducing, but it is getting almost impossible to take less than this because of how horrific the withdrawal feels. It is just worse than the withdrawal I've been coping with up to this point. I'd call my GP but they're not open again til Monday. I want to keep reducing, so I can start lowering the dose of Trazodone next (which I dread as it controls my mental health very well and has done for 6+ years, but I am focused on the bigger picture of having a family). 


If there's any advice on how to reduce these symptoms,  especially the feeling in the stomach and the feeling of being utterly uncomfortable in my own skin like it doesn't fit and is full of ants, I'd super appreciate it. It is horrible, and really hard to deal with on top of chronic pain which leaves me disabled even with the full painkillers I was on.",2,1,2020-06-19,mental health during pregnancy,530,,,,,,,,,
AskDocs,untreated ureaplasma infection in pregnancy,"i apologize for the long post, but i’d like to start this off by giving a little background. on march 12th, i got a message from my doctor saying i tested positive for both ureaplasma and mycoplasma. both my boyfriend and i took 250 mg azithromycin for ten days and abstained from intercourse as directed. after the antibiotics were done, we continued as we usually did. 

june 16th, i went to my doctor appointment and was told they needed to retest me for mycoplasma and ureaplasma as they forgot to do it after i finished the antibiotics. they sent the wrong tube to the lab and had to redo it on july 1st. 

july 5th, i went to the hospital when i woke up with severe back pain. i normally woke up with moderate low back pain, and i’ve had back pain for years, so when it was so severe i wanted to cry, i knew something was up. i was admitted with a kidney infection that was thankfully caught early on. they did two rounds of iv antibiotics over the course of two days, as well as iv iron for severe anemia. i was also told i have hydronephrosis. i was sent home with a prescription for 325 mg ferrous sulfate and sulfamethoxazole that i take twice a day. 

july 10th, i get a text from my pharmacy saying they’re going to call my doctor regarding a new prescription that was sent in. i checked the app, and my normal doctors office had prescribed 150 mg clindamycin hcl with the directions to take three pills three times a day for a week. the pharmacy has still not filled this prescription, and i was also in the dark as to why it was prescribed. 

which brings me to yesterday, july 13th. i got a message from my doctor saying i’m still positive for the ureaplasma infection but not the mycoplasma. it explains so much: off smelling discharge, most likely the uti that led to my kidney infection, why i was prescribed more antibiotics on top of the ones i’m already taking. 

my main concern here is what has this done to my baby? i know as a pregnant woman that infections can do things to the baby when they are left untreated. i’m not very happy with my doctors because they “forgot” to retest for the infection and let it go for 4 months untreated. i’ve read that ureaplasma can cause uti’s but it’s not the most common way. i would also like to know if my baby is born with complications due to the infection, or if i had any complications during labor, if there’s any sort of legal action i can take. 

if you read all of this, thank you. i resort to this sub more often than i’d like to, but i have a lot of concerns as this is my first pregnancy. anything helps :)",2,1,2020-07-15,early labor,489,,,,,,,,,
AskDocs,I am getting coflicting opinions from my clinic. I have some questions about determining risk factors and coronavirus,"This is about my daughter and myself. 
I (38m) am a military spouse and I use tricare. I am also a disabled vet and could use the VA, but have never enrolled in the VA health care system. My daughter is 2 and only has acess to tricare. 

We were contacted by the clinic on the base to inform us that we were high risk. This made sense because I have had a previous acute myocardial infarction and currently have hypertension. We also received a  call for my daughter, but her problems are far more extensive. She was born with an AV canal defect. She was in the hospital for a long time over this. She came home trached and vent dependent. She also came home with a GJ tube. Her list of previous and current ailments include 
- Necrotizing enterocolitis developed after birth due to bloodflow problems. She was not premature. Resolved after heart repair.
- bronchiotracheo Malaysia. Resolved with age and the tracheostomy has been removed. 
- laryngeal cleft, unresolved.
- pancreatitis- resolved after lipid treatment ceased for NEC
- She also had two serious bouts of pneumonia 

Now the confusing part. My wife has been working from home during the pandemic because of our high risk status. I have reduced my hours to stay home with the kids. I work alone so my my exposure risk is minimal. Last week her commander started requiring everyone who was not high risk nor had high risk family members to come back to work. No problem, we just contacted the clinic through the secure messaging service. The strange part is that our doctor replied that neither one of us was high risk, due to being young. This is the exact same clinic that called us out of the blue to warn us we were high risk.

 My wife was forced to start coming back. She is exposed to a large number of people daily. There is also a stigma around following CDC guidelines in the military, or at least at her base. 

My three specific questions are
- Should I enroll in and then go to the VA for a second opinion? 
- Should I cough up the money for my daughter to be seen by a private practitioner? 
- Do we seem high risk to you?",2,5,2020-07-09,premature birth,387,,,,,,,,,
AskDocs,"Iud left in pregnancy, pregnancy failure rate after 20 weeks?","If having an iud in place during pregnancy (couldn’t get it out) makes it a 50/50 chance of miscarriage until 20 weeks but then preterm labor (which I thought was the same thing after the 20 weeks mark) is 25%, Does that mean your chances of pregnancy failure goes down after 20 weeks? I’d figure it’d go up so I’m confused. 

Female 34 

TLDR; Does change of pregnancy failure go down after 20 weeks?",2,1,2020-08-15,preterm labor,74,,,,,,,,,
AskDocs,Sedentarism and shortness of breath making me fear Pulmonary Embolism,"Background info: 27y, male, 175cm, 89kg, slightly overweight, no other chronic diseases that I know of (currently in investigation for possible Dysautonomia because of my constant high heart rate).


I've been extremely sedentary ever since the vírus started. I've been working from home ever since March, only going out for groceries and stuff. Just in these last 6 months, I've put on a significant amount of weight due to the sedentarism and eating a lot of junk food.

I can't get over the fear that my sedentarism and weight gain has caused a blood clot and that I could die at any moment. I have noticed that I get winded easily lately, it's not like ""omg, I can't breathe"". It feels more like a subtle air hunger, a very subtle ""suffocating"" feel whenever I do slight exertion or even at rest. My pulse ox shows my oxygen levels always between 96-98%. I've also counted my respiratory rate mostly between 12-15. Yet I can't get any piece of mind. I'm tired of feeling like I'm gonna die.

I've literally spent the last few days on a strong impulse of reading all about DVT/PE on some hopes of getting reassuring information, but it's only brought me more suffering. Every time I feel even slightly out of breath I instantly fear the worse. I'm too scared to go to the hospital because of the vírus, and my family has pretty much given up on me, basically written me off as some nutty hypochondriac, and every time I say I'm not feeling well they just say that it's my anxiety acting up, since I've gotten several cardiac exams during the last few years and nothing abnormal has shown up except for fast heart rate. 

As I type this post, I'm freaking out because my oxygen levels are at 96% instead of the usual 97-98%.

I spend pretty much the entire day sedentary, but I do get up to go to the bathroom, eat, shower, etc. I also try not to spend more than 3 hours lying down. I'll get up and stretch my legs a bit. Is that enough movement to avoid DVT's? I've read that most cases have some other underlylng causes like recent surgery, trauma, pregnancy, cancer, and long travels sitting in one position. None of those risk factors apply to me, yet I also read that just being sedentary at home could be a risk factor, and now I'm freaking out.

Would really like some insight regarding my worries. Thanks in advance!",2,4,2020-09-08,pregnancy trauma,421,,,,,,,,,
NICUParents,Advice please re feeding (do I buy a breast pump in preparation or wait?),"In brief, I am 24w5d with my boy and have weekly NHS appts to monitor chances of preterm birth. 

I have got loads of stuff ready for the baby already in case of this possible/likely NICU situation. I've done it all on a super tight budget, mostly second hand stuff, and am proud of that.

I am ready and happy to push the boat out on a new double electric breast pump as I want to breastfeed if I can and I want to give myself the best chance of succeeding. Black Friday would be a good time to commit.

BUT would you advise waiting? Maybe I won't be able to breastfeed anyway? Should I see how I get on in NICU with their pumps first? Maybe my babe by some incredible luck won't arrive early?

Looking forward to hearing your experiences.",2,20,2020-11-24,preterm birth,142,,,,,,,,,
AskDocs,Is it possible to conceive after abnormal cel biopsy?,"Age: 34

Height: 5'0""

Weight: 190 lbs (working on losing weight currently)

Medications: Megestrol 40 mg, ibuprofen (prn), tylenol (prn), Omeprazole, Citirizine, Flonase

A little background:

I recently went through the medical ringer when I suddenly had a 29 day long, incredibly heavy period that would not stop no matter what.. Four months passed where I had 19 -29 day long periods that were incredibly heavy and painful while only having a short reprieve between. 

I was diagnosed with a uterine polyp, and went in for a D&C soon after that. 

After lab results came back, I was told that the polyp came back with complex, atypical hyperplasia with squamous morules.  There was no active cancer present, but precancerous cells definitely were. 

I was sent to see another doctor, and was put on Megestrol for the next three months to make sure all of the carnage is cleared out of my uterus. 

My two doctors seem to be giving me two different opinions on the matter, though.

One is telling me that I should forego trying to have children and have a hysterectomy in order to squash the chances of cancer developing. He said he's never seen a full, healthy pregnancy come from a person who came back with complex cells before. 

The other doctor seems confident that I can conceive (albeit probably with the help of a fertility specialist and medications), and carry a baby full term. 

I wanted to get some other opinions on the matter and see if there is a chance that I could conceive and carry a healthy baby to birth, or is it not worth the risk?

Anyone's input is welcome. Thank you in advance!",2,1,2020-08-31,full term birth,281,,,,,,,,,
BabyBumps,Pelvic pressure/early delivery?,"Hello! I'm 35+4 weeks. I started getting pressure on my pelvic area and I'm pretty sure it's because my baby has dropped. This is my second baby and I didn't have this issue with my first. One of my friend said after she experienced the pelvic pressure, she gave birth after 2 weeks and was 2 weeks early. Now I'm curious if other Mama's out there gave birth early once they started feeling pelvic pressure or if you felt it early on but still went to full term. Would love to hear your timeline on your experiences!",2,11,2020-09-29,early delivery,97,,,,,,,,,
BabyBumps,"Bumpers, how are you dealing with the holidays?","With the ongoing pandemic, how have your holiday plans changed and how are you dealing with that? 

There have been studies showing that covid during pregnancy leads to increase risk of death, premature birth, miscarriage, and the list goes on. After reading about this, my SO and I (currently 25w0d) decided to be a lot more vigilant on leaving the house (only for groceries and pick up when possible) and who we saw (only other people who didnt go out). However, this means I don't get to see most of my family since they work jobs where they have to interact with people. For Thanksgiving, I didn't get to see my family and that was fine, but with Christmas coming up it is getting hard for me to stick with our plan of not interacting with our loved ones because I really miss them. It also doesn't help that people don't seem to understand or think it's a big deal. 

So I'm curious to hear what my fellow bumpers have planned for the upcoming holidays during the pandemic.",2,15,2020-12-06,premature birth,178,,,,,,,,,
PregnancyUK,F(25) first pregnancy - nervous as all hell!,"Hey lovelies. 

I recently discovered that I am expecting my first baby, although because I don't have periods I have no idea how far along I am.

I took a clear blue test which indicated conception to be 2-3 weeks ago, but I've already got swollen breasts, a visible bump and I'm urinating all the time. Also I'm slightly constipated 🥴 

When I called my doctor's surgery (University Doctors surgery) to make them aware of the pregnancy the receptionist said I would have a phonecall appointment on the 23rd of September (not an ultrasound). Is this normal? If I am already tender and showing I could be over 12 weeks by the time I have that phonecall...

Furthermore, I told the receptionist that I'd been experiencing sharp stabbing pains in my lower right side over the previous month. She didn't ask me anymore about the pains and just said if they got worse I should go to the walk-in centre.

Adding to all this: my doctor's surgery doesn't *deal* with pregnancies because they are a university surgery. This means I have to attend a sister centre somewhere else in the city and I have no midwife or doctor set up. 

The last 2 nights I've woken up in the night gasping for breath and panicking. I'm *hoping* (for lack of a better word) that this is a combination of stress and anxiety and exhaustion from working. But I'm also terrified it might be something else to worry about. 

Does anyone have any advice for me? I'm so nervous about this whole pregnancy and I feel really lost at not having a straightforward set up with the doctor like I had assumed.",2,9,2020-08-31,pregnancy stress,281,,,,,,,,,
AskDocs,"I found out I was pregnant at 14 weeks, and drank heavily before.","I found out I was pregnant at 14 weeks, and up until that point, I fell into covid depression and was drinking 3-5 drinks each evening (white claws, specifically). I stopped drinking as soon as I found out. I’m 20 weeks now, and my anatomy scans came back on track, but I still cannot stop panicking. Everything I read mentions that the late first trimester is one of the most important for determining FAS facial abnormalities, and that I engaged in “binge drinking.” I also read  conflicting information about how FAS is more of a concern for pregnant woman who drink heavily throughout the pregnancy. My OB knows that I drank during the first trimester, and has essentially told me that the best thing I did was stop as soon as I found out, but I’m still an absolute wreck. I already love this baby deeply, but the thought that I could have harmed him, along with the fear of judgement should he be born with distinctive facial features of FAS has me absolutely wrecked. I know much of what I may get here will be general information, but I just need something to keep me from absolutely falling apart. My mental health is so fragile right now, and I’m just so damn terrified and guilty and devastated. I’m worried about what little string is holding me together right now.",2,6,2020-10-15,mental health during pregnancy,230,,,,,,,,,
AskDocs,What does the placenta results I received actually mean?,"I received the below results after having my 34 week preemie about the placenta. Could I get an ELI5 description of what they found?

age: 29, sex: F, height: 5'4"", weight: 130's before and after pregnancy and 156 on admission day, race: white, no existing medical issues, no medications during pregnancy besides prenatal vitamin, no drinking/smoking/drugs then either.

**G1 with premature   rupture of membranes at 32-1/7 weeks. Vaginal delivery at 34-2/7 weeks of 4   lbs. 15 oz. female infant with Apgars 8 and 9.**

**A. Placenta, third   trimester delivery:Early third trimester placenta (401 g; 34 weeks).Three-vessel umbilical cord with no diagnostic abnormality.Extraplacental membranes with mild reactive amnion.Placental disc with mild reactive amnion.**

**A. Placenta**

**A. Received in   formalin labeled with the patient's name and ""placenta"" is a single   disc placenta. The gray-white 3 vessel umbilical cord measures 18 cm in   length by 1.2 cm in diameter and inserts 4 cm from the edge of the disc.   Spiraling is generally consistent with one twist per 1–2 cm. Gray-tan,   semitranslucent membranes insert marginally. The rupture site is 2 cm from   the disc edge. Trimmed of the umbilical cord and peripheral membranes, the   disc weighs 401 g and measures 18 x 15.5 x 2.6 cm. The fetal surface is   blue–gray. The maternal surface is red–brown, grossly complete. The cut   surface is red–brown, spongy, with no discrete lesions.Cassette summary:1. Umbilical cord and membrane roll2. Central disc3. Paracentral disc4. Maternal surfaceRJB/BKF 02/06/17 16:34:48 EST**

**Unless designated as   gross examination only, a microscopic examination has been performed and is   reflected in the above diagnosis(es). If utilized, each immunohistochemical,   in situ hybridization or histochemical stain documented is performed on a   separate slide, unless otherwise specified. All controls stained   appropriately.**",2,1,2020-09-25,early delivery,282,,,,,,,,,
AskDocs,"Diagnosed with inflamed colon, need advice until my colonoscopy next week","Age 21

Sex Female

Height 5'9

Weight 190 ish 

Race White 

Duration of complaint About a week

Location Colon/Anal region

Any existing relevant medical issues Lots of medical issues, only relevant would be GERD and IBS. 

Current medications So many... Amitrypteline, Naprosyn, Zofran, Bentyl, Roprinolol, Omeperozole, Topamax, Vit D, Calcium, Emetrol 

Include a photo if relevant Don't think anyone wants me to do that. 

So long story short I went to the hospital Thursday evening in severe abdominal pain at the advice of my doctor. We thought pancreas attack or ectopic pregnancy. Turns out, after being given some torodol for the pain and having a CT, my colon is inflamed, more than likely due to my years of IBS and intestinal inflammation. I was sent home from the hospital with a new script for Naprosyn and Zofran, both of which I have taken before with no allergic reactions.

My newest symptom happened yesterday, to put it bluntly my ass cheeks are burning. The part where they touch and you have to spread them to see anything Almost feels like chafing and they're red like it too, no other signs of trauma to the area. No hemorrhoids or fissures, I'm having the small amount of discharge that the nurse said would be normal, but this feels like diaper rash or something and I don't know whats going on. I also realized today that I haven't shit since Friday, but I'm in no more pain than i have been and im not vomiting or bleeding.. Sorry for the graphic descriptions and I appreciate the help.",2,2,2020-10-15,pregnancy trauma,263,,,,,,,,,
