BabyBumps,Pregnancy after premature birth (incompetent cervix/PPROM) and progesterone supplementation as a preventative measure. Any moms with experience?,"Four and a half years ago I gave birth to my son at 31 weeks. My water had broken and within an hour I was at the hospital. A cervical check revealed that my cervix was pretty much fully effaced and I was 1cm dilated. I gave birth 13 hours later.

I am now expecting baby #2 and will be meeting with an OB in two days (I'll be close to 16 weeks pregnant), and I was wondering if I should insist on taking progesterone (through either vaginal suppositories or the 17P shots). I previously met with this OB (two years ago) and he only mentioned monitoring my cervix thickness through transvaginal ultrasounds for future pregnancies and using progesterone if there was evidence of thinning. However, I've recently looked up some articles and it seems like progesterone is often recommended as a preventative measure after having a premature delivery to decrease the risk of another preemie (rather than just waiting for evidence of the cervix starting to thin).

I was just wondering what other moms in a similar situation have experienced and what was recommended to them. Also, for those who supplemented, did you take progesterone vaginally or through shots?",6,8,2020-06-16,prematurity,200,,,,,,,,,
BabyBumps,Overly fearing a miscarriage with 0 chill,"Possible triggers: cancer
Recently I have felt completely out of control hormonal. I am almost 9 weeks and suffer from extreme PTSD as a cancer survivor. I also suffer from generalized anxiety disorder. As a result of my medical history I have completely convinced myself there is no way my pregnancy will go smoothly. 

I have experienced occurrences of spotting since 7 weeks. Never longer than an hour at a time and only usually when I wipe after using the restroom. Generally the “blood/sporting” doesn’t even reach my pad. I have no cramping or other symptoms aside from pretty rough nausea and very sore boobs. Essentially no reason to expect anything bad. 

ALSO should add, at 7 week check up (because I panicked about spotting) I saw my baby bean, heard it’s heart and everything size wise is on track. When I say no reason to worry I really mean that. 

But there is just this overly powerful voice in my head demanding I listen to it and worry about losing my baby. I fear letting people down. I fear not wanting to try again if I do lose the baby. I’m mortified today specifically after a rough night of no sleep and lots of work/moving related stress. 

I guess I’m just looking for some words of encouragement. Natural methods for relaxing as: my bath tub is broken, I’m a (clean for 4 weeks now) pothead, with work coming up (special ed teacher all virtual this year), and a move being made complex by a shitty seller who thinks she can breach contract and force a later move in date. The anxiety has me at the end of my rope and I’m ALREADY taking anxiety meds (baby safe). 

Any ideas friends?

Edit to add more detail",6,7,2020-08-29,PTSD pregnancy,296,,,,,,,,,
BabyBumps,So overdue!,"Hi bumpers, UK lady here. 

Can someone please give me a shred of hope? I’m now 6 days overdue (40+6) I’ve had two failed membrane sweeps, one on my due date, and one at 40+4. They said they could feel the babies head, but they could only get their fingertip into the “second part” of my cervix, whatever that means. 

I’ve not had a single Braxton hicks AFAIK, not a twinge, no mucus plug loss, bleeding, etc. 

I’ve only got 4 days until I have to go in to be induced, is there any hope this baby is going to come on it’s own?",6,20,2020-06-10,overdue,104,,,,,,,,,
NICUParents,Cost of NICU stay and Insurance Coverage,"Hello everyone,

I know that this subreddit is for the support for the parents whose babies are in the NICU. Much strength to you guys who were going through tough times and I hope the situation gets better for everyone experiencing this.

We are having twins (MCDA) and the due date is in October. But I just wanted to prepare if we are anticipating few weeks of stay in the NICU. I am concerned mostly about the cost for the NICU stay and the insurance coverage. In general, how much will be the cost for the NICU stay per day and how much the insurance will be able to cover the cost. I talked to my insurance company (UHC) and they told me that there will be a charge of $500/day for the inpatient stay. And I am pretty sure we will hit our out of pocket max ($7.5k for individual and $15k for family) if we are staying in NICU even for atleast couple of weeks.

What will be the better option in terms of insurance and how can I prepare myself to financially manage if there is a NICU stay for few weeks/months?

Thanks in advance.",6,7,2020-07-03,NICU stay,198,,,,,,,,,
BabyBumps,Should I Buy Preemie Clothes?,"I was diagnosed with preeclampsia and admitted for 24 hours of monitoring today at 33+6. Baby will come sometime between now and 37 weeks depending on how things go. At the 32 week growth ultrasound, baby was 67th percentile.  In normal times I would probably just wait and send someone to Target if necessary, but I don't want the extra COVID exposure so would like to order what I will most likely need. I have a ton of newborn clothes. Should I also get preemie clothes? How many of what? Should they be long sleeves since preemies don't regulate heat as well? Do I need a special smaller swaddle (is there such a thing)? Thanks!",6,18,2020-06-19,preemie,115,,,,,,,,,
AskDocs,34 weeks pregnant and baby weighs 2lbs.,"My sister is 34 weeks pregnant and the baby weighed just under two lbs last week (at 33 +1).  My sis sees her two doctors (OB/GYN and MFM) twice a week.  The baby had stalled in growth for a while (I am not sure how long) around the same time that my sister was discovered to have some blood clotting disorders.  She has been on blood thinners since about week 22.  Her OBGYN told us this week that the baby will not reach 4lbs before birth (sometime in the next 6 weeks)and will stay in the NICU until she does reach 4 lbs and can eat on her own.  Her original due date was Dec. 16.  Modified due date was Dec 27.  We were told this week she will not go past Dec 20.  Sis has opted to have a c-section whenever the doctors or her body decides it is time.

I can only find info on babies born that small at 24-26 weeks.  i can't find anything about a baby being that small at this gestational age. the baby has gained 10oz in the past month.  My sister's nurse told her today that this is a miracle baby.  I don't think they ever said as much but it is starting to be clear that the doctors and nurses did not expect the baby to survive this long.

My sister is single, 22, 5'1"".  she weighed about 100lbs but now weighs 124lbs.  she did smoke, drink and do drugs (weed, cocaine, meth) previously but I don't think she has done much more than weed in the 6 months before she got pregnant.  She has always had problems with eating and nausea and now has been diagnosed with antiphospholipid syndrome and some other blood clotting disorders that we had no idea about.  the baby has checked out normal for chromosomal and genetic abnormalities.  No amniocentesis was done. her amniotic fluid values have been between 6 and 8.  baby did have some heart issues (two stenoses and a psuedo hole) but at the most recent ultrasounds the problems seem to have resolved.

what can we expect after the baby is born?  how likely are serious problems?",6,5,2020-11-06,NICU stay,364,,,,,,,,,
NICUParents,C-section for preeclampsia at 29 weeks,"Hi everyone, I'm currently 29 weeks, 5 days pregnant and hospitalized for preeclampsia. My blood pressure has been a little high and my liver values are trending upwards. It is looking like I will need to have a c-section in the next few days. I'm just feeling a little blindsided and lost, just wondering if this community has any advice for a NICU stay at this gestational age? Any tips or advice would be greatly appreciated, thanks so much.",6,11,2020-08-14,gestational age,79,,,,,,,,,
PregnancyUK,Moving hospital in late pregnancy?,"Hiya, looking for some advice from others who have done this previously! 
I'm 25 weeks and currently living in England. Due mid March with my first. 
We'd wanted to move to Wales this year but, due to Covid, my husband was unable to get a job transfer over there.
Now, a few spaces for transfer have just opened up and, whatever happens, we can't afford to turn the opportunity down. This would possibly mean him moving over there mid/late Feb.

If this happens, I might have to move my maternity care from where we are in England, to the nearest hospital in mid Wales - and it would be very late in my pregnancy!
Has anyone else changed hospitals due to moving? Is the process difficult? I want to be prepared just in case we have to get a move on with this pretty quickly, should the need arise.",6,10,2020-12-04,late pregnancy,149,,,,,,,,,
BabyBumps,"FTM 26+6, got to spend the late night in L&D to rule out preterm labor.","So...I've had a few contractions here and there but since yesterday I've been having constant ones. They're not full uterine contractions..they are mostly localized to the right side which feels weird. But up until late last night they were only 2-3 an hour, then around 10pm they suddenly became <10mins apart consistently. So at the direction of the phone triage nurse we hop in the car and head to L&D. Everything turned out fine, it's not preterm (yet) but...I could go for the contractions stopping any time now. I'm chugging water, taking tylenol....laying around.... and they're just not stopping.",6,0,2020-07-31,preterm labor,99,,,,,,,,,
AskDocs,My veins are suddenly very visible all over my body,"Hi there,

I'm 25, female, non-smoker, no chance of pregnancy.

I noticed 3 nights ago that all of a sudden, my veins are EXTREMELY visible to the point of looking luminous, like very bright green and visible, under skin. In particular my upper body - my chest, shoulders, arms, down to my hands.

No other changes during this time except I just finished my period, have been stressed and anxious because of Covid, and have had bouts of nausea/headaches recently but attributed them to mental health issues and too much sun exposure.

Other maybe important information: I have been doing little to no exercise during quarantine apart from a few walks a week. And a couple years ago a doctor told me I have a low blood palette count.

Not having any pain.

No chronic health issues; don't smoke/do drugs, am pretty thin.

Does this sound serious and a reason to get checked out by a doctor?",6,3,2020-06-04,stress during pregnancy,157,,,,,,,,,
NICUParents,Premature babies book recommendations?,"Hi all, our baby boy was born at 34+1 last Sunday following unexpexted PPROM during a low risk pregnancy. He is on his 8th day in hospital now. 

We were obviously not prepared for this at all and all those books I read during pregnancy on early sleep training or breastfeeding a full term baby now seem completely irrelevant to his care. Our little man is on half oral / half ng feeds and we haven't seen too much progress on feeding over the past week.

Does anyone have any book recommendations about a baby's time in NICU and/or bringing home a preemie baby? I feel so unprepared for everything.",6,20,2020-11-09,prematurity,110,,,,,,,,,
NICUParents,Vaccine schedule for SVT Premature baby,"My baby boy was born when he was 34 weeks with SVT he is now 2 months chronologically and 15 days gestational. He was given hepatitis vaccine when he was in the NICU. I am worried about the upcoming DPT shot, as I read stories by mama’s saying their babies had terrible fevers some were vomiting didn’t want to eat and very sore and lumpy leg where shot was given. Parents of SVT babies any advice ?",6,14,2020-10-29,prematurity,77,,,,,,,,,
BabyBumps,How are you coping with covid-19 changes and pregnancy?,"So this is probably going to be a long rant, but I’ve been feeling so hopeless lately and I’m sure I’m not the only one. How are you all coping and living your lives in the midst of all of this?

I’m 24 weeks and due in late September. My husband is active duty military and this is our first baby. I’m so excited for this baby, we’ve been trying for years, and I lost my last pregnancy. I’m so thankful to be expecting this little boy and that he is healthy and active so far.

Being pregnant during all of this just really sucks. So I’m going to complain to the internet because I feel like a jerk when I do it to my friends and family. I just heard my baby’s heartbeat for the FIRST TIME  yesterday because all of my appointments since I was 9 weeks have been over the phone. My husband wasn’t allowed to that appointment and won’t be to any in the foreseeable future. He is also beyond paranoid and has a fit if I even go to the grocery store, so I’ve been essentially isolated since early March (my job moved to 100% remote work in March). I’m dying for a prenatal massage or a prenatal yoga class or something to help with my old back injury flaring up. None of the maternity clothes I’ve ordered online fit right. Literally no one has seen me pregnant at all since we announced except online-and virtual hangouts are getting so old. My birthday is in a few weeks and I have no idea how to safely celebrate and I just have this feeling that I’m going to be isolated for a really long time, especially once the baby comes. When I found out I was pregnant I had planned on traveling to my hometown in July for a baby shower which probably won’t happen now. I guess I had a lot of expectations for this pregnancy because we tried so long for it, and it just hasn’t been what I expected at all.

These are all such first world problems and I feel so dumb complaining about them at all when people are dying. I know why all of this is necessary and I’m trying so hard to be careful for my sake, my baby’s sake, and the sake of people around me. But I guess all the hormones have me especially emotional today and I wanted to see how everyone else is coping. It doesn’t help that I live in a very popular tourist destination that has completely reopened so we are flooded with vacationers who don’t mask or social distance at all, and most people we know don’t really do much to prevent infection. Everyone here has pretty much gone back to normal almost 100% and I’m just afraid to do that? But I guess I feel jealous of their lack of fucks to give. 

How isolated have you been? Is it messing with you mentally? Am I just being melodramatic and selfish? I’ve been so positive to everyone I talk to, and tried so hard to be upbeat and excited when I talk to them, but I’m feeling more hopeless every day that this is just the beginning.",6,12,2020-06-07,coping during pregnancy,546,,,,,,,,,
PregnancyUK,I can’t enjoy this,"I’m 15w and my depression is back. Our house renovations are only unearthing more fucking problems so we can’t really start anything of real impact. Tomorrow, we’re surrendering our youngest cat because they won’t stop attacking each other. I’m in pain, physically. My family lives in another country and my husband’s parents are cunts. 
In short, I haven’t enjoyed much of this journey yet and I’m tired of being so deflated.",6,2,2020-10-23,pregnancy depression,71,,,,,,,,,
AskDocs,My veins are suddenly very visible all over my body,"Hi there,

I'm 25, female, non-smoker, no chance of pregnancy.

I noticed 3 nights ago that all of a sudden, my veins are EXTREMELY visible to the point of looking luminous, like very bright green and visible, under skin. In particular my upper body - my chest, shoulders, arms, down to my hands.

No other changes during this time except I just finished my period, have been stressed and anxious because of Covid, and have had bouts of nausea/headaches recently but attributed them to mental health issues and too much sun exposure.

Other maybe important information: I have been doing little to no exercise during quarantine apart from a few walks a week. And a couple years ago a doctor told me I have a low blood palette count.

Not having any pain.

No chronic health issues; don't smoke/do drugs, am pretty thin.

Does this sound serious and a reason to get checked out by a doctor?",6,3,2020-06-04,mental health during pregnancy,157,,,,,,,,,
NICUParents,Emotional Rollercoaster,"Hi there! First time posting here. I had my son on Tuesday via emergency c section due to very rare preeclampsia called HELLP Syndrome. He was 10 weeks early, but his dr’s say he is doing well. I was supposed to go home today, but my blood pressure doesn’t want to seem to go down to normal despite the hypertension medication I’m on. I’ve never had high blood pressure before pregnancy. 

It also sucks because we have a 6yo daughter at home. So my husband is back and forth between the hospital and home. Seeing my baby with tubes and wires coming out of him breaks my heart. And knowing I can’t get home to my daughter saddens me too. There is no real winning here. Either way I’m leaving one of them behind for the time being. I’m just sad. Not PPD or anything, just genuinely sad. 

I’m frustrated because people keep trying to tell me how to feel: “don’t be sad, he’s doing great”; “you can’t be sad you have to be strong to get better”; etc. I know I need to be there for myself and my kids, but a lot has happened in the last 4 days. I think I deserve a minute or two to just feel how I want to feel! I’m not looking for pity, I just want to be express normal emotions that come along with stressful situations! 

I’m just tired and miss my bed. I’m not looking forward to leaving baby at the hospital when I’m discharged.",6,10,2020-12-27,pregnancy stress,256,,,,,,,,,
BabyBumps,Is pregnancy depression a thing?,I just don’t feel like myself anymore and not sure what to do.,6,13,2020-07-06,pregnancy depression,13,,,,,,,,,
BabyBumps,"Freaking out as a pregnant, working person in Covid world","Hey folks, I just wanted to see if other people feel this way. I'm 10 weeks FTM, and baby was a bit of a surprise. We're very excited for the baby, but the timing isn't awesome. I work in healthcare in a region where Covid prevention measures have never really existed, and our numbers are still high and always rising.

I'm kinda freaking out all the time, because best case scenario I'd prefer to just be at home to feel safe and sound, but we can't afford for me not to work. And the idea of going back to healthcare environment after baby is born is just so difficult for me to imagine right now. 

That was all a bit specific, but I just wanted to explain my situation with this. Are any of you also panicked a bit over pregnancy/childbirth/newborn parenting during Covid? Is it changing how you would've otherwise handled things? Is it affecting your career plans? How are you coping? It's pretty consuming for me right now. Thank you!",6,15,2020-10-16,coping during pregnancy,172,,,,,,,,,
BabyBumps,Things I can donate?,"I'm 17 weeks along, so this may be a little premature. I'd like to know what pregnancy related things can be donated. I just learned you can donate your umbilical cord. Can anything else with the delivery be donated? When can I donate my blood after giving birth? I also saw that I can donate milk. Can I pump before labor, so I'll have my milk on hand for baby in case it's needed?",5,11,2020-07-12,premature birth,74,,,,,,,,,
BabyBumps,Anyone have insight on moving late in pregnancy? Currently 34 weeks.,"*BABY BRAIN EDIT: baby brain took over and I totally forgot our lease ends about a month after I’m due. So we would be moving as new parents. 

-

Me and my husband weren’t intending on buying a house at all because well I’m pregnant... but we may have found the one. The right location, the right price, paying the same as we do for rent for so much more space...just the timing isn’t ideal.

We know how it feels to be homeowners but being parents will be new to both of us. 

Has anyone moved late in their pregnancy or planning on moving as well? Would just like some insight.",5,12,2020-05-14,late pregnancy,111,,,,,,,,,
AskDocs,"34F, Pregant 7 weeks. Chances to suffer same complications as during 1st pregnancy?","Age- 34

Sex- F

Height- 167cm

Weight- ~100kg

Race- white/european

Duration of complaint- n/a

Location- Uterus - Western Europe

Any existing relevant medical issues- first pregnancy (twins!) ended at 32weeks

Current medications - non

Include a photo if relevant- n/v

Non smoker, no alcohol, no drugs


I am pregnant the second time. 7 weeks, so it is still early.
Now I am concerned that I could suffer early delivery again like I did during the first time.

Background:
My first pregnancy in 2016 was with di-di twins. 
I was doing good in the beginning, no servere morning sickness, all values good.
In week 29 my gyn discovered that my cervix had shortend to 14mm (if I recall correctly) and I had early contractions.
I was admitted to the hospital immediately, put on best rest, received meds to stop the labor (tokolyse, if this is an english term at all?). I also received antibiotics as there seems to have been an infection.
Well, from week 30 on my amniotic fluid got lower and lower.There was probably a leakage in one of the sacks. 
Also, my cervix just ""vanished"" over the time. It was down to 4mm.
At 32 wks the twins were delivered via c-section.

The hospital told me I had a cervix insufficiency.


How likely is it that this will happen again this time? Was it just bad luck, or because of twins? 
Should I mentally prepare myself for long bed rest and a NICU stay?


I will obvl discuss this with my doc, but the next appointment is in 3 weeks and I am just nervous and worried.


Thanks!",5,3,2020-10-04,c-section delivery,270,,,,,,,,,
BabyBumps,Preemie car seat help/suggestions,"Hey all. So have a 31 weeker that will need a car seat. We bought a Graco that i will link here:

https://www.babiesrus.ca/s/toys-ca/en/Graco-Modes-Travel-System---Britton---R-Exclusive/1A3CBF03.html?gclid=Cj0KCQjwuL_8BRCXARIsAGiC51DMj-tsDeFKBKHLxJF-nA6kdSlAPoEXy7UrY1sN8JnDRkM9t_faS6UaAgmlEALw_wcB

We got it home built it, and were immediately concerned about the car seat for a preemie. It has almost no support/pillows for head and neck other than a thin white insert that you can in the images.

Did we make a mistake here? The store offered to do an exchange but I'm unsure what would be a good replacement.

We're looking at the following since it has some more support but unsure if it's worth the price increase ($CAD):

https://www.babiesrus.ca/en/Peg-Perego-Ex-Book-Cross-Travel-System---Cinder---R-Exclusive/57590391.html

We've mainly been looking at full travel systems like the above, but wouldn't object to buying individual pieces.

Thanks so much in advance, worried and pretty unsure what to do but i want to keep him safe as he will have some dr appointments that we will need to drive 4 hours to get him too.",5,14,2020-10-22,preemie,160,,,,,,,,,
BabyBumps,Inducing labor,"My fiancée was having contractions and dilated to a 3 at 32 weeks, so the hospital gave her magnesium to stop to close her back up. Now she’s 38 and we have tried everything to induce. What are the best way to induce at this point? She’s dilated to 3cm and 70% and has been this way for about 2.5 weeks.",5,9,2020-10-30,induced labor,61,,,,,,,,,
AskDocs,Haven’t had my period in 6 months. I’m freaking out.,"I am not pregnant. I have not had my period in 6 months and I’m terrified I’m going through premature menopause. 

I have pcos but prior to this 6 month gap, my periods were always regular. 

I’m 28 years old and would like babies in future. Terrified I’m infertile.",5,3,2020-09-02,premature baby,49,,,,,,,,,
AskDocs,13 weeks pregnant on medications Cymbalta Vyvanse and Xanax as needed for severe ptsd depression and anxiety,"39 yo female
5’5
160 pounds
Current meds:
Cymbalta 60mg
Vyvanse 70mg
Xanax 1mg as needed for panic and anxiety

Severe ptsd/ trauma and sexual abuse by stepfather at 4-16 years old

Severe depressive disorder and severe anxiety

I am currently 13 weeks pregnant and stable on my medications. I am seeing an obgyn maternal medicine specialist and psychiatrist and therapist. I am choosing to continue my medications throughout my pregnancy as the benefits outweigh risks. I am looking for any guidance or advice on this subject as I am aware of the category of each med “c” 
I am afraid to go off of these medications as this is the most therapeutic regime I have been on and have been able to feel normal and live a non-debilitating life.",5,9,2020-05-17,PTSD pregnancy,130,,,,,,,,,
