NICUParents,Feel like baby is languishing in NICU,"Hi all, long time lurker, first time poster. I feel like my 30 weeker is languishing in the NICU. We’re on Day 44. He’s been off the CPAP for about 2 weeks and is working on bottle/breast feeding. I’m in the NICU from roughly 8am to 7pm and breast feed twice a day (my supply is taking a hit from the prolonged stress I think. That and I can’t sleep- Im typing this at 4am). He still has an NG tube and has been progressing in his feeds, but it’s not linear at all- the first week he was POing 20 percent of his feeds, next week 40 percent, this week 50-70 percent. However this varies from day to day. I think the NG tube is probably contributing to his inability to finish his full feeds and events. He also just gets fatigued. He’s still having a lot of minor Brady’s and desats which he recovers from by himself, with some more “significant” ones thrown in. He did have a blood transfusion about two and a half weeks ago and his hemocrit is a little low but not at the point that they would transfuse again. 

Every day I am being told that he’s just “premature and needs to grow” and “every baby is different”. But I’m afraid I’m missing something and it’s causing his development to delay.

I’m at the end of my rope. I break down in tears multiple times a day. I’ve survived abuse, health crises, you name it, but this is breaking me. I’m crying as I type this. The NICU we’re at has good doctors and the nurses have been solid for the most part. I spend hours and hours reading about potential issues or ways to address them. The staff are responsive but I feel like they aren’t being proactive. And meanwhile time keeps rolling. It’s also not a great environment to be in day in and day out- it’s loud, overhead lights, I don’t have a lot of space to sit in, it’s incredibly hard to breastfeed. Yesterday I felt like I shouldn’t even go in for the next couple of days as maybe the nurses could get him to the point where he’s taking enough feeds by mouth so his NG tube could be pulled. But the idea of not seeing him for even a day makes me sick to my stomach. I need a “win” to keep going. Thanks for reading.",29,27,2020-07-16,premature baby,410,,,,,,,,,
NICUParents,InterInteresting trend happening. Lower preterm births during lockdown.,,29,14,2020-07-20,preterm birth,1,,,,,,,,,
NICUParents,Parents who had a micro preemie: how did your subsequent pregnancies go?,"For those that have had a micro preemie in the past, can you share how your subsequent pregnancies went? Were they full term? Did you get progesterone shots, a cerclage, etc? Would love to know what your doctor recommended as a course of action to prevent another preemie. My daughter was born very prematurely and the doctors say I must have had an undetected infection. Anyone else had the same? Picture of my little girl, Sienna, whose now [2 but was born at 25w+6!](https://imgur.com/a/IvDbAAg)",28,19,2020-09-05,early delivery,84,,,,,,,,,
NICUParents,Needing alone time,"I'm 9 days past my emergency c-section at 28 weeks. Baby boy is doing reasonably well, and I'm recovering from the surgery ok. 

But I am feeling *extremely* anti-social, and I'm not sure how to deal with it. My husband went back to work today so I need to rely on people for rides for a while, but I am really dreading making conversation in the car. We've had people offer to bring food to the house, but I'm exhausted just by the thought of making small talk when they drop it off. The texts and calls from grandparents overwhelm me. I don't know how to talk to people about the actual delivery because it was so unexpected and frightening, and there's still quite a bit of it I don't understand myself (I have an OB appt tomorrow where I can ask a lot of questions). 

I'm conscientious of PPD and I don't think this is it-- my husband and I have moments of joy together, I'm eating normally, I look forward to going to the hospital to visit my son, etc. I just need a long break from the outside world. How long did it take you to feel ready to be (at least minimally) social again? In tbe meantime, how do I politely but firmly rebuff the well-wishers?",28,28,2020-08-18,c-section delivery,220,,,,,,,,,
BabyBumps,Studies are showing that preterm births are down nearly 40% since the start of the pandemic!,,27,10,2020-07-29,preterm birth,1,,,,,,,,,
PregnancyUK,Prenatal depression sucks but Kiwi always cheers me up!,,27,4,2020-12-18,pregnancy depression,1,,,,,,,,,
NICUParents,Parents who had a micro preemie: how did your subsequent pregnancies go?,"For those that have had a micro preemie in the past, can you share how your subsequent pregnancies went? Were they full term? Did you get progesterone shots, a cerclage, etc? Would love to know what your doctor recommended as a course of action to prevent another preemie. My daughter was born very prematurely and the doctors say I must have had an undetected infection. Anyone else had the same? Picture of my little girl, Sienna, whose now [2 but was born at 25w+6!](https://imgur.com/a/IvDbAAg)",27,19,2020-09-05,early labor,84,,,,,,,,,
NICUParents,Needing alone time,"I'm 9 days past my emergency c-section at 28 weeks. Baby boy is doing reasonably well, and I'm recovering from the surgery ok. 

But I am feeling *extremely* anti-social, and I'm not sure how to deal with it. My husband went back to work today so I need to rely on people for rides for a while, but I am really dreading making conversation in the car. We've had people offer to bring food to the house, but I'm exhausted just by the thought of making small talk when they drop it off. The texts and calls from grandparents overwhelm me. I don't know how to talk to people about the actual delivery because it was so unexpected and frightening, and there's still quite a bit of it I don't understand myself (I have an OB appt tomorrow where I can ask a lot of questions). 

I'm conscientious of PPD and I don't think this is it-- my husband and I have moments of joy together, I'm eating normally, I look forward to going to the hospital to visit my son, etc. I just need a long break from the outside world. How long did it take you to feel ready to be (at least minimally) social again? In tbe meantime, how do I politely but firmly rebuff the well-wishers?",26,28,2020-08-18,early delivery,220,,,,,,,,,
AskDocs,Gynecologists: is it standard procedure to pull down a woman’s cervix during labor?,"I had my baby a couple months ago and I was wondering if it’s standard procedure to pull on a woman’s cervix while she’s in labor? I was induced at 7am that day, the gyno came in 3 different times throughout the day to check on me. The first 2 times she couldn’t find my cervix and said it was pushed so far back, the third time she found it and PULLED IT DOWN. I screamed so loud. It was the worst pain I’ve ever been in in my life. It was worst than contractions, worst than the actual delivery. I get terrible flashbacks of that day and I’m scared to have any more kids because of it. 

I was speaking to an old friend earlier who works in the healthcare field and she told me that the gyno was really wrong for doing that and I should look into my rights.

Is she right? I really don’t know anything when it comes to that and I don’t know if she’s just saying that or if I could actually build a case around that. Just looking for a second opinion I guess. 

(Cross-posted)",26,8,2020-10-25,induced labor,193,,,,,,,,,
BabyBumps,How careful are you being with COVID?,"Hi guys,

Like all of you, I'm trying to navigate these crazy quarantine times we're in with COVID-19.  Up until recently, we've been trying to social distance with our friends (who work in various public arenas, send their kids to day  care, etc.) by meeting outdoors and staying 6 feet apart. Now that it's getting cold, my husband and I are trying to figure out what's responsible as far as indoor gatherings go, which is up to 20x more risky as far as virus spread. 

Mostly our question is, do we ask everyone to wear a mask any time we see them indoors? It feels so awkward and also like it will lead to us not hanging out with people much this winter.

ANYWAY my question is, what are you doing with your closest friends? Masks at all times? No meetings at all? I need some guidance here. 

2 recent studies made us get a lot more serious about our distancing policies. The CDC showing COVID is associated with increased risk of preterm birth, miscarriage, and stillbirths. 

https://www.msn.com/en-us/health/medical/covid-19-linked-to-preterm-deliveries-cdc-report-says/ar-BB197hDR?li=BBnb7Kz

Another study from JAMA done in London found that since covid, stillbirths have gone up 4x, even in babies with no birth defects. https://jamanetwork.com/journals/jama/fullarticle/2768389

Not trying to scare anyone, just looking for a discussion on the recent studies and your thoughts moving forward into winter. Thanks! 🙂",26,34,2020-09-26,preterm birth,225,,,,,,,,,
NICUParents,2nd time NICU parent,"My oldest son had a lymphatic malformation that was diagnosed in utero at 20 weeks. He was eventually delivered through an EXIT (intubated during delivery ) procedure at 35 weeks. He was in the NICU for 87 days before he was discharged with a tracheostomy and a feeding tube. He has had more surgeries than I can count.  He is now a teenager. He is going well, but will eventually need more orthodontic surgery. 

We were expecting a healthy baby boy last week. He was delivered at 37 weeks via c-section due to uterine scaring from my previous c-sections. I was not given steroids ahead of time. Despite being full term he suffered from respiratory distress syndrome (wimpy  white boy).  His lung partially collapsed, and he was air lifted to a hospital with a level 3 NICU. He is improving, and we are hoping to have him home for Christmas.  

COVID has complicated everything. The hospital only allows one parent at a time. There are no private restrooms, and no eating in the patient room. I'm 4 days postpartum, and I'm pumping. I can't drive yet, and people are constantly mask-less in the family waiting room. Even staff pull down their masks to talk on a regular basis. Not only are we concerned for our newborn, but our older son is on an immunosuppressant. 

The docs are very optimistic. I'm just struggling a bit.",26,7,2020-12-07,c-section delivery,234,,,,,,,,,
PregnancyUK,In the hospital and too excited to sleep,"Update:
We got stuck at 9 cm. had an emergency c section and our boy was delivered at 12:30 Wednesday. Still positive and happy with how it went in the end x

I’m in the wide awake club. Had a gel induction at 2 pm yesterday (I’m 12 days over due day) Immediate contractions that got very strong very fast. Plans for a pool delivery were scrapped fairly quickly and I opted for an epidural. Best. Thing. Ever. I can feel everything ( like you can feel someone holding your had) but zero pain. Even the catheter going in. I can also move my legs, but no walking. But I don’t feel trapped and can try different positions when pushing time comes. After a breakdown due to being alone a lot at first, thanks anxiety, I’m now so chilled and happy.  Just waiting to be told I’m at 10 and it’s go time.
Midwives are a special kind of angel. Every single one I’ve met has been so patient and understanding x 
Sharing the good news so far",26,6,2020-11-18,c-section delivery,178,,,,,,,,,
BabyBumps,Early labor is the worst tease (37+6 FTM),"Last Thursday I started having some contractions, very very slight, felt like a period cramp, only had 3 from Thursday until Sunday. Okay, cool, things are happening. 

I go to my appointment on Tuesday and my doctor says I’m 3 cm dilated and 60% effaced already!!! Yay! Things are happening! I’ve been spotting some old blood though since then which hasn’t been thrilling but otherwise feeling great. 

The rest of the day I felt a little weird and had a teeny bit of cramping, but yesterday morning I started having some contractions! Yay! I let my husband know to be on standby, and hop in the shower in case I start progressing faster. These were probably a 4/10, not bad. 

THEN EVERYTHING STOPPED. I GOT NOTHIN. 

Happened again at night, I lost a big chunk of mucus plug with some bright red blood in it after being on my yoga ball all day and going for a walk, and this time my back hurt SO BAD, hopped in the shower again and went to bed. 

NOW NOTHING. 

I want this baby out damn it!!! It’s 100 degrees out and I’m tired of feeling like a greased up rotisserie chicken.",23,13,2020-09-03,early labor,199,,,,,,,,,
NICUParents,NICU bound,"My wife is 28+5 and we have been told our baby is in the 1st percentile, weighing in at around 800g, with no amniotic fluid as highlighted at the 28 weeks scan (scan on week 23 was fine).

We're scared now because blood flow is good so the consultants are entertaining possible genetic/chromosomal issues.

The challenge we have is running the risk of inducing early delivery (and everything that comes with that) by testing for chromosomal abnormalities via invasive methods. What do we do? It's such a difficult decision to make because if we found that the baby had serious conditions that would limit quality of life we would have a difficult decision to make. If we don't, we don't.

**Update 3rd December**: we got viral tests back to confirm they aren't the cause of the small size. Following that we made the decision to undergo the CVS test. This is going to be the longest 2 weeks of our lives!",22,21,2020-11-27,early delivery,161,,,,,,,,,
BabyBumps,The hospital I've been going to is forcing all of the women to be induced at 39 weeks and I was wondering if this is normal?,"I'm currently 21 weeks pregnant and the hospital/OBGYN I've been seeing has made it a ""rule"" now that all women are to be induced at 39 weeks. I don't know if this is COVID related or if it has more to do with the fact that the OB department is severely lacking staff at this hospital and they just want things to be scheduled out. 



I'm not sure how I feel about this though regardless of what their reasoning is, I'm not super gung-ho on ""everything has to be natural"" philosophy but I do feel like it's just unnecessary and that a baby will make their arrival when they're ready. Unless I had some medical issue where they had to induce or went a week or more past my due date, I get it. But to just say ""you have no choice over how you birth"" seems really...wrong. By the time I'm full term I'll have an 18 month old and I'd rather labor at home for as long as possible so we're not gone from her very long and I have no idea what their covid response will be to having her come after the baby arrives. 


The next closest hospital is an hour away and I haven't called them yet to see what their policies are but I definitely plan on it. I just don't like them being so far either...I don't know I guess this is sort of a rant but what would your thoughts be on this and induction in general?",22,31,2020-08-20,full term birth,255,,,,,,,,,
NICUParents,My full term baby developed breathing issues due to fluid in his lungs a few days after birth,"My baby was born 9/22 at 39 weeks 1 day.  He had a low heart rate and a low body temperature at birth, so he was taken to the NICU to be put under the warmer and to be evaluated for cardiac issues.  I have a genetic cardiac condition, so it was upsetting but not surprising to discover that he has it too.  He was put on proper medication and his heart rate went up and his body temperature became stable as well.  

We were preparing for him so be discharged when his oxygen saturation started taking alarming dips.  They did a chest X-ray on him and discovered that he had fluid in his lungs.  He was put on oxygen and will now need to stay a few extra days to clear out his lungs and get weaned off of oxygen.

I’ve heard of TTN, but from what I understand, it presents itself almost immediately after birth.  The doctors don’t fully understand why his issue didn’t start until about 3 days after birth.  I’m so grateful that we were already in the right place for him to get treatment when they caught it and that he was not discharged too soon, but I can’t help but worry about him.  The doctors haven’t actually used the term TTN to describe his condition, so there may be something different going on.  

Has anyone had a similar experience?",21,8,2020-09-27,full term birth,235,,,,,,,,,
BabyBumps,Coping with extra vivid dreams / nightmares while pregnant,"I've always had very vivid dreams, but pregnancy has been a whole other level. During my last pregnancy, I had sporadic nightmares so terrible that I would wake up my husband screaming. 

 I'm barely 5w pregnant now, and woke up terrified last night after a horrible nightmare. Anyone have tips on how to calm down and fall asleep again? Between being pregnant and having a 7month old, sleep is so precious!",21,12,2020-08-07,coping during pregnancy,71,,,,,,,,,
BabyBumps,"Unsupportive, uninterested husband","Hello everyone. This is my first time posting on this sub. I’m a first time mom (26F) who is 23 weeks pregnant with my first baby due in September! I’m really excited about the baby and my pregnancy but I don’t think my husband (32M) feels the same and I was hoping to get some advice/support. 



Ever since I’ve gotten pregnant, he seems to have lost interest in me / the baby. We haven’t done anything “date-like” for months and haven’t had any physical intimacy since February. He doesn’t make an effort to spend time with me or even talk to me despite my bringing it to his attention. I’ve asked him many times if we can hang out and spend time together and I just get excuses (I’m busy, I’m tired, after my test we will hang out etc.). What bugs me is that he spends hours talking to his mom and brother on the phone and he spends sooo much time watching YouTube videos or reading stuff online related to technology and his other hobbies. Despite this, he hasn’t done much research on baby-related things and has made minimal effort to emotionally support me during my pregnancy.  He’s felt the baby kick 3 times and I have to insist he comes and feels my belly and once he feels the baby move he goes away and does something else. He hasn’t made much effort to make sure I’m doing ok and am not lonely even though I specifically moved in with him so he wouldn’t miss pregnancy milestones and so I could have support during the stay at home directive. I lived alone near the University I attend prior to moving in with him so being able to spend time with another person during the stay at home directive was supposed to help me not be lonely and stir crazy.



He knows it’s a concern of mine because I keep bringing it up and I’ve cried a bunch of times over feeling lonely. I’m at a loss of what to do since bringing it up doesn’t help. With the stay at home order still in place in our state, I can’t see my friends. My family lives a flight away so I can’t see them either. I’ve been doing my best to keep in touch with people virtually but it’s not the same as spending time together in real life. 



Has anyone else gone through a similar situation? How did you deal with it / cope? Would you recommend I join some new mom groups on Facebook to find more support?



Thank you all in advance!",21,11,2020-05-18,coping during pregnancy,438,,,,,,,,,
NICUParents,Jacob’s Journey: The Boy Born Early,,21,0,2020-10-23,born early,1,,,,,,,,,
BabyBumps,"Introduction and Daily Bump Picture Thread - December 31, 2020","Are you pregnant, supporting someone who is pregnant, or planning on getting pregnant in the future? Then welcome to /r/BabyBumps!  



Please take a moment to familiarize yourself with our [**Rules**](https://www.reddit.com/r/BabyBumps/wiki/rules). In short, we do not allow spam, advertising, solicitations, or the sharing of any personal information. Polls/surveys/market research must be authorized by the mod team prior to submission. We ask that ALL bump pictures remain in this daily sticky only and that ultrasound and announcement pictures remain in the weekly designated sticky. Please do not ask us if you are pregnant, could be pregnant, or what symptoms others have experienced prior to confirming pregnancy. Likewise, please do not request or offer medical advice. We ask that if you post a picture of your baby you do so only as a bonus to other meaningful content (like a birth story). We do not allow pictures of your pets and we ask that all political discussion be in the realm of pregnancy, family planning, delivery, postpartum care, and/or parenting. Also, be cool. DBaA.  


We have some *fantastic* resources available to you over in [**Our Wiki**](https://www.reddit.com/r/BabyBumps/wiki/index). With links for those of you trying to get pregnant, answers to common questions and concerns regarding pregnancy, resources and lists pertaining to pregnancy and/or common symptoms, conditions, and complications thereof, resources pertaining to birth, and a list of [acrynomns](https://www.reddit.com/r/BabyBumps/wiki/acronyms) you may run into, we hope your immersion into our community is as seamless and supported as possible. 


If you're looking for your [**Monthly Bumper Sub**](https://www.reddit.com/r/BabyBumps/wiki/index) you'll find links here. Please note that these subs tend to go private and that the moderators of Baby Bumps are not affiliated with private subs. We cannot add you or request that you be added. You'll have to message the moderators of your private bump sub and ask to be added; instructions for how to do this can be found in the link provided. 


We have [A Chat!](http://webchat.freenode.net/?channels=BabyBumps&uio=Mj10cnVlJjQ9dHJ1ZSY5PXRydWUmMTE9MjU2JjEyPXRydWUa6)  


[Flair](https://www.reddit.com/r/BabyBumps/wiki/flair) is awesome and helps you [find stuff](https://www.reddit.com/r/Babybumps/wiki/sort).  


If you can't find what you're looking for here, you may be able to find it in one of these [Other Helpful Subreddits](https://www.reddit.com/r/BabyBumps/wiki/subreddits).  


If you are not yet pregnant, are trying to get pregnant, believe your period may be late, or have questions pertaining to family planning, please check out the Stickied Weekly Introduction Thread over on /r/TryingforaBaby. It's amazing. You'll learn more about reproduction than you ever thought was possible.  


And now - for the main event - from maternity photos to bathroom selfies, show us those bumps – big or small!",21,84,2020-12-31,late delivery,419,,,,,,,,,
NICUParents,UPDATE POST: Our IUGR Peanut,"Hello all,

Posted about 6 months ago that we found out about our little peanut's IUGR diagnosis at 24+6.

So, a quick rundown: wife went into full on preeclampsia 6 weeks later, BP peaked at 190/110 and she was admitted for the week prior to birth. Her condition reached critical mass and at the end of January, our little one made her grand entrance via emergency C-section, weighing in at only 1lb 14 oz.

Baby quickly established herself as top dog on the NICU, with everyone involved in her care remarking at how feisty and full of life she was, even at such a premature age.

We were absolutely thrilled to find out her growth restriction was ""asymmetric"" and that her brain and other vital organs were where they should be developmentally. In addition, none of the other abnormalities or deficiencies we had feared for based upon initial findings were present. Besides being tiny, she is perfectly healthy aside from a little reflux. We are immeasurably blessed.

After 83 grueling days, our little one came home. She's been home almost 3 months and is now over 10 lbs. She is still on the small side for her weight, but her development and milestones are in line with her age. She loves laughing, smiling, and playing with her toys. She has begun to find her voice and her stubborn personality continues to shine through. 😉

I haven't commented here much (only lurked) since that original post, but I'm thankful for all of the positivity and support here.

To the parents facing this now: you are strong and you are awesome, and so is your baby. Not everyone gets the unique privilege of being a NICU parent. This trial will be testing, but it will eventually end, and your baby WILL come home. I'm so proud to be a NICU dad, and the growth I experienced both personally and with my wife as a couple has been invaluable.

Stay strong. ✌",20,1,2020-07-09,premature birth,329,,,,,,,,,
NICUParents,Appropriate growth curves?,"What growth curves did your pediatrician follow after you left the NICU? Our pediatrician was tracking our 26 weeker on a normal full term baby curve based on his adjusted age and he was doing fine. Then today she showed us a different curve, one that is specific to premature babies born at various completed gestational months and his percentiles have suddenly increased. Basically the difference between the two is that this one tracks him against other preterm male babies. Technically he should be on a curve that starts at -3 months (born 3 months before due date), but the one she had started at -2 months. Presumably this curve merges with the full term baby curve at some point?",19,13,2020-06-08,gestational age,120,,,,,,,,,
