subreddit,title,text,score,num_comments,created,keyword,word_count,"Rate the intensity of the stress described in the post on a scale from 1 to 10, where 1 = no stress, 10 = extreme stress, and -1 = no mention of stress. (Danielle)","Rate the intensity of the stress described in the post on a scale from 1 to 10, where 1 = no stress, 10 = extreme stress, and -1 = no mention of stress. (Hadas)","Rate the intensity of the stress described in the post on a scale from 1 to 10, where 1 = no stress, 10 = extreme stress, and -1 = no mention of stress. (Model)","Evaluate the level of emotional overload or mental exhaustion described in the post on a scale from 1 to 10, where 1 = no overload, 10 = extreme overload, and -1 = no mention of overload. (Danielle)","Evaluate the level of emotional overload or mental exhaustion described in the post on a scale from 1 to 10, where 1 = no overload, 10 = extreme overload, and -1 = no mention of overload. (Hadas)","Evaluate the level of emotional overload or mental exhaustion described in the post on a scale from 1 to 10, where 1 = no overload, 10 = extreme overload, and -1 = no mention of overload. (Model)","Identify the week of pregnancy mentioned in the post as a number (e.g., 20 for week 20). If no week is mentioned, return -1. (Danielle)","Identify the week of pregnancy mentioned in the post as a number (e.g., 20 for week 20). If no week is mentioned, return -1. (Hadas)","Identify the week of pregnancy mentioned in the post as a number (e.g., 20 for week 20). If no week is mentioned, return -1. (Model)"
BabyBumps,Some very “WTF” things they don’t tell you about pregnancy.,"25 weeks, first-time mom. Here is a list of things that NO ONE bothered to tell me about being pregnant:

1. You haven’t actually stopped peeing until you try it once, stand up, sit down and then pee a second time. Leaving the house without doing this will bring you a world of regret (especially since public restrooms aren’t a thing right now.)

2. Your nipples will leak without telling you and then they will dry, and you’ll look down the next morning and immediately think you have cancer or a rare nipple disease oh my god. 

3. Speaking of nipples, they are permanently erect now and they feel like fire at all times. You can cut glass with them. You are now Andy Bernard in that episode of The Office with the rabies fun-run. 

4. Your baby can, and WILL, kick you square in the butthole from inside the womb. They do not apologize. Do not expect flowers. 

5. First kicks don’t always feel like butterflies or a fun little goldfish. They can also feel like your bladder is trying to off itself one explosion at a time. It will launch you off the couch in a panic and there is nothing you can do about it. 

6. You won’t know where your stomach is anymore now that your organs are all squished around. Your doctor doesn’t know. Your midwife doesn’t know. Nobody fucking knows but you’ll still get reminded that it’s there by the HOT LAVA heartburn that happens if you even THINK about a banana before going to sleep. 

7. Doing the dishes takes three sessions because standing up is impossible for more than two minutes. You will feel like you need an oxygen tank. Or a priest. 

8. Constipation is more difficult than normal because, as you may remember from #6, you don’t know or understand where your organs are anymore. Your body is just trying to poop but your liver and kidneys suddenly have to voice their shitty opinions, as well as whatever the hell is in your ribcage at the moment, and you more than likely will google “AM I DYING?” at four AM. This will happen more than once. 

Have I missed anything? I’m only 25 weeks so I guess I get another full trimester to find out. Pregnancy is such a BEAUTIFUL MIRACLE.


(Edited to change acronym ‘FTM’ to ‘first-time mom’ to avoid confusion.)",4386,1006,2020-05-17,weeks pregnant,402,,,,,,,,,
BabyBumps,"When I first got pregnant with this baby I checked the TP for blood every time I wiped because I've had 11 previous miscarriages. But now, at almost 38 weeks, I'm checking again, but this time it's for for signs of labor!",,4013,136,2020-09-03,weeks pregnant,1,,,,,,,,,
BabyBumps,Adoption and pregnancy.,"Guys, we just adopted our (almost one year old) son from foster care ON April 2. Just took a test this morning (after trying for five years).

I am in shock. Ran to fertility clinic and beta is 450.

IM GOING TO HAVE TWO KIDS IN THE SPAN OF A YEAR!!!!!!!   I had an ectopic in 2018 so it may happen again, but it feels different this time.

Haven’t even told my husband yet.

OMG GUYS

EDIT: beta came back today! Tripled from Friday. Looking good! Told my husband too, no clue how to upload a pic or video to Reddit But I will post it on my Instagram at the 12 week mark @themurphyhouzz",2082,211,2020-06-05,pregnancy stress,115,,,,,,,,,
BabyBumps,I had my daughter 5 months ago. I just came her to share a bit and say ALWAYS TRUSY YOUR BODY. It's because of someone's misfortune and heartbreak sharing on here that my daughter and I are alive.,"I had a very rough pregnancy. Very high risk with lots of complications. I also have very bad medical anxiety and fear I'm wasting doctors time and that what if I'm faking and just don't know it?


I had gone to the hospital 20+ times at 34 weeks. Mostly for real issues. Had actually been admitted for a few days a few times.


Well I had just left the hospital on a Friday and started not feeling right Saturday evening. Sunday morning a poor mother shared her story of not trusting her body and unfortunately losing her child. She was sharing awareness for other moms and I am beyond thankful for her.


She was having a lot of the same issues as me.


Didn't feel baby moving, bad headache, and just a bad feeling.


So I called my ob, told her I was coming in something didn't feel right I hadn't felt baby girl move in over 12 hours. Called my husband to leave work early and come get me because I was too lightheaded to even walk by then.


We get in, my blood pressure is through the roof, my protein is up, my uric acid is up, and they are having a really hard time finding baby. My ob stopped by and told me ""you're a ticking time bomb. I can't send you home"" so I stayed overnight. The next morning my favorite nurse who I knew a bit by then, came in super sad. Informed me she was really sorry but my numbers were rapidly going up. I was going to be induced. We started including at exactly 35 weeks.


I had gone from risky blood pressure to full blown pre E overnight. It took 3 days to get me to dilate. When I started pushing and got baby girls head out I had my ob scream at me to stop pushing. Turns out baby girl had wrapped her cord around her next a few times and that's why her heart beat was down, and she wasn't moving a lot. Thankfully after almost 4 weeks in the nicu she got to come home, and now we have a happy semi healthy 5 month old spit fire.


However if that post wouldn't have convinced me it was better to waste a doctors time and be wrong than not go in and be right, both my daughter and I would be dead. Mama's, listen to your body. Listen to your instincts. Even if you nothing outwardly is wrong if you KNOW something is up go in.


Stay safe. Stay healthy. Stay excited.


And to that mama, who posted on like June 4th or 5th in so sorry for your loss, but thank you so so so much for sharing. I will literally never forget you.",1863,93,2020-11-21,pregnancy anxiety,466,,,,,,,,,
BabyBumps,I had my daughter 5 months ago. I just came her to share a bit and say ALWAYS TRUSY YOUR BODY. It's because of someone's misfortune and heartbreak sharing on here that my daughter and I are alive.,"I had a very rough pregnancy. Very high risk with lots of complications. I also have very bad medical anxiety and fear I'm wasting doctors time and that what if I'm faking and just don't know it?


I had gone to the hospital 20+ times at 34 weeks. Mostly for real issues. Had actually been admitted for a few days a few times.


Well I had just left the hospital on a Friday and started not feeling right Saturday evening. Sunday morning a poor mother shared her story of not trusting her body and unfortunately losing her child. She was sharing awareness for other moms and I am beyond thankful for her.


She was having a lot of the same issues as me.


Didn't feel baby moving, bad headache, and just a bad feeling.


So I called my ob, told her I was coming in something didn't feel right I hadn't felt baby girl move in over 12 hours. Called my husband to leave work early and come get me because I was too lightheaded to even walk by then.


We get in, my blood pressure is through the roof, my protein is up, my uric acid is up, and they are having a really hard time finding baby. My ob stopped by and told me ""you're a ticking time bomb. I can't send you home"" so I stayed overnight. The next morning my favorite nurse who I knew a bit by then, came in super sad. Informed me she was really sorry but my numbers were rapidly going up. I was going to be induced. We started including at exactly 35 weeks.


I had gone from risky blood pressure to full blown pre E overnight. It took 3 days to get me to dilate. When I started pushing and got baby girls head out I had my ob scream at me to stop pushing. Turns out baby girl had wrapped her cord around her next a few times and that's why her heart beat was down, and she wasn't moving a lot. Thankfully after almost 4 weeks in the nicu she got to come home, and now we have a happy semi healthy 5 month old spit fire.


However if that post wouldn't have convinced me it was better to waste a doctors time and be wrong than not go in and be right, both my daughter and I would be dead. Mama's, listen to your body. Listen to your instincts. Even if you nothing outwardly is wrong if you KNOW something is up go in.


Stay safe. Stay healthy. Stay excited.


And to that mama, who posted on like June 4th or 5th in so sorry for your loss, but thank you so so so much for sharing. I will literally never forget you.",1861,93,2020-11-21,NICU stay,466,,,,,,,,,
BabyBumps,What 10 weeks pregnant feels like,,1778,74,2020-07-24,weeks pregnant,1,,,,,,,,,
BabyBumps,"5+1 and despite huge anxiety over them being okay in there, I already care so much about this little bean. Drawing helps it feel real",,1728,125,2020-07-23,pregnancy anxiety,1,,,,,,,,,
BabyBumps,Just had my first appointment at a fertility clinic and turns out - I’m already pregnant!!!!,"For the last couple years I’ve had irregular periods, I used to only get them every 6 weeks and now it’s every other month.  My family doctor has never been able to diagnose the reasoning for it and said sometimes women just don’t ovulate for no explained reason and that when I’m ready to start trying, he’ll refer me to a fertility specialist right away.  My fiancé and I decided to start trying at the end of October and my family doc immediately wrote me the referral.

Since then, I’ve been mentally preparing myself for the upcoming struggle ahead and have lost sleep for the past month about it.  The initial ultrasounds and bloodwork are supposed to be done on your period so I’ve been waiting for mine to come and finally Tuesday this week I started to bleed and booked my appointments.  The next day I stopped bleeding and the clinic told me to keep my appointments anyways.  This just made even more upset thinking that the stress I’ve been putting on myself is making my menstrual cycle even more messed up.
 
Today I went in, did my ultrasounds and bloodwork and the OB came to speak to me after and told me I’M ALREADY PREGNANT!!!!!! He said I’m only 4-5 weeks and that it’s still really early but I immediately started sobbing.

For years now I’ve been hating my body for not being “normal” with no unexplainable reason.  I had already prepared myself for the thought of years of trying to conceive and all the medication or procedures I might have to take and just knowing that my body IS ovulating and I’m able to conceive has been the biggest weight ever lifted off my shoulders.  Whether or not I make it to full term I’m just so happy to know that something is working and even though it’s too early to share with friends and family...I had to share this good news with someone who might also be worried their irregular period automatically means infertility.

Any early term advice is greatly appreciated and I’m so excited to be on this journey with all you other women out there!

Update:  I set up cupcakes and a pregnancy announcement on my fiancé’s desk for when he got home.  Worst timing he came home when I was on a video conference call with my work team!! He was jumping and screaming and ran to gave me kisses.  Fortunately I muted and turned my camera off in time.  Ironically enough on the call my colleague shared for the first time that his wife is pregnant and due in the spring. I’m the only female on my team and everyone kept telling me I’m next!  I laughed it off but little do they know I just found out today that I actually am!! It will be funny to tell them later that the same day they told me I’m next, was actually the same day I found out I was pregnant!",1661,187,2020-12-11,pregnancy stress,499,,,,,,,,,
BabyBumps,"We did it!! Meet Ana and Eva, born on 12/11 at 35+6 after two early labor scares. Successful twin VBAC, very positive story in comments!",,1580,54,2020-12-13,early labor,1,,,,,,,,,
BabyBumps,"We did it!! Meet Ana and Eva, born on 12/11 at 35+6 after two early labor scares. Successful twin VBAC, very positive story in comments!",,1578,54,2020-12-13,born early,1,,,,,,,,,
BabyBumps,"I am an older mom, due in 2 weeks. I just realized that when this baby is born I will have have had a baby in each of the 4 previous consecutive decades (90s, 2000s, 2010s, and 2020s) and will have given birth to Millennials, Zoomers, and Gen Alphas.","I will have 8 children whose ages are 27, 20, 11, 7, 7, 5, 4 and the one due in 2 weeks. I had my first baby as a teenager and will be giving birth to my last baby at the age of 45.

My work here is done and I am exhausted. 😂",1543,140,2020-09-07,week of birth,54,,,,,,,,,
BabyBumps,Little guy has arrived at 27 weeks after 6 uncertain weeks in hospital for momma. Birth story in comments,,1498,54,2020-11-01,NICU stay,1,,,,,,,,,
BabyBumps,In the hospital 18.5 weeks pregnant recovering from brain surgery.,"These past few days have been the absolute scariest days of my life and I just need to talk and share with other moms.
I am 18.5 weeks pregnant and since week 12 ish I’ve had terrible headaches. I called my OB twice who has helped a ton with meds and just trying to get me through that second trimester headache wave. Thursday afternoon it was so bad no meds were helping and I could barely see. My OB sent me to labor and delivery triage and after giving meds with no improvement decided to do an MRI just Incase.
Within an hour I was told I had three brain aneurysms one 14mm long that was already leaking and was rushed my ambulance to our university hospital neurological ICU and in brain surgery within hours.
I don’t remember much I just remember being so scared for my baby boy and begging for them to make him safe.
After a 5 hour surgery everything is fixed went perfectly and I’ve been able to see him on an US and listen to his heart tones five times a day since. 
I am so thankful I caught it in time. He was kicking so much before I went under anesthesia it’s something I’ll never forget. I felt like he was just telling me “we got this mom” I just can’t believe we’ve been through so much together already. He’s so damn tough😭
Our bodies are seriously miraculous. Thanks for letting me share, alone in the hospital and just wanted to talk💙


******Thank you from the bottom of my heart for these kind messages. I’m trying to respond and answer but with my head pain and left arm/hand weakness it’s getting exhausting lol! All these messages have brought so much light to these terrible few days I really appreciate you guys giving me the space to share some not so joyful news on this forum and get it out. Joyful now but for sure not easy to read or hear. I knew out of anyone you guys would understand my fear and just overall stress more than anyone. My baby boy and I thank you from the bottom of our hearts💙☺️",1457,113,2020-07-05,weeks pregnant,367,,,,,,,,,
BabyBumps,In the hospital 18.5 weeks pregnant recovering from brain surgery.,"These past few days have been the absolute scariest days of my life and I just need to talk and share with other moms.
I am 18.5 weeks pregnant and since week 12 ish I’ve had terrible headaches. I called my OB twice who has helped a ton with meds and just trying to get me through that second trimester headache wave. Thursday afternoon it was so bad no meds were helping and I could barely see. My OB sent me to labor and delivery triage and after giving meds with no improvement decided to do an MRI just Incase.
Within an hour I was told I had three brain aneurysms one 14mm long that was already leaking and was rushed my ambulance to our university hospital neurological ICU and in brain surgery within hours.
I don’t remember much I just remember being so scared for my baby boy and begging for them to make him safe.
After a 5 hour surgery everything is fixed went perfectly and I’ve been able to see him on an US and listen to his heart tones five times a day since. 
I am so thankful I caught it in time. He was kicking so much before I went under anesthesia it’s something I’ll never forget. I felt like he was just telling me “we got this mom” I just can’t believe we’ve been through so much together already. He’s so damn tough😭
Our bodies are seriously miraculous. Thanks for letting me share, alone in the hospital and just wanted to talk💙


******Thank you from the bottom of my heart for these kind messages. I’m trying to respond and answer but with my head pain and left arm/hand weakness it’s getting exhausting lol! All these messages have brought so much light to these terrible few days I really appreciate you guys giving me the space to share some not so joyful news on this forum and get it out. Joyful now but for sure not easy to read or hear. I knew out of anyone you guys would understand my fear and just overall stress more than anyone. My baby boy and I thank you from the bottom of our hearts💙☺️",1457,113,2020-07-05,pregnancy stress,367,,,,,,,,,
BabyBumps,Baby Janixsa graduated 39+5 6lbs. 7oz. right when we were expecting 2 hurricanes to hit. Daddy felt it appropriate to make a meme.,,1372,38,2020-08-28,NICU stay,1,,,,,,,,,
BabyBumps,"Meet baby Maverick. Born via cesarian this morning (9/12/20) at 3:07 AM and weighing in at 1 pound, 9 ounces",,1293,68,2020-09-12,preemie,1,,,,,,,,,
BabyBumps,I’m late but here is my sweet Lily. We are finally home after 77 days in the NICU. She was born at 27 weeks 4 days gestation after a traumatic emergency delivery. She weighed 2lbs 10oz. Here she is today at a chunky 8lbs 4oz! Any preemie moms on here?,,1242,166,2020-08-26,preemie,1,,,,,,,,,
BabyBumps,I’m late but here is my sweet Lily. We are finally home after 77 days in the NICU. She was born at 27 weeks 4 days gestation after a traumatic emergency delivery. She weighed 2lbs 10oz. Here she is today at a chunky 8lbs 4oz! Any preemie moms on here?,,1239,166,2020-08-26,late delivery,1,,,,,,,,,
BabyBumps,Can we please stop calling it “natural birth” to describe a vaginal birth?,"My unplanned cesarean birth was not natural because we utilized medical procedures to have a safe delivery. I wanted and tried to have a ‘natural birth’ ... A VAGINAL birth, the way your body is designed to release the baby. We tried and tried and she would not come out. It was time to trust the medical professionals who said it was time to do a C-section. Yes, it is not the natural way to have a baby, fine. But every time you post a comment, title, or story and refer to vaginal birth as ‘natural birth’ ... it alludes that my cesarean delivery was an UNNATURAL birth. It’s just not very sensitive. And nothing about me doing anything possible to have my baby safely is unnatural. It’s completely natural to use everything available to you to protect your baby, even if it means getting your own body sliced and diced. 

Thank you.",1138,694,2020-11-24,c-section delivery,153,,,,,,,,,
BabyBumps,A PSA from a L&D RN to anyone who might need to hear this ❤️,"A disclaimer: I’m not a lurker, I’m also on this journey (for the 4th time!) with y’all! 

On to my message:

I’ve been so thankful to have these groups to keep me entertained, celebrate, commiserate (GD!), and learn about new things! One thing that I keep seeing pop up is about moms not wanting to impose on the nurses during labor, feeling embarrassed about things that happen during labor/pp, or worrying about expressing their desires during the hospitalization. 

I’m here to speak for majority of L&D RNs when I say - WE LOVE OUR JOBS!! We know that with labor and childbirth comes strong emotions, family dynamics, throw up, blood, poop, sweat, and other fluids. And that’s okay! Cause we also know that as part of our job description, we get to be there when little babies come into the world and take their very first breath, when women get to witness just how amazing their own body is to have created a perfect little person, and see their own strength to have gone thru childbirth- whether vaginally or via major surgery. I mean- come on! does it get any better than that?!

We as women often have such complex relationships with our body images, for one reason or another. And to be present when a fellow woman has the opportunity to see that we are made for this... well that is just another perk of the job. 

I know that some of you may have seen us when we are not at our best and I’m sorry about that. We are just people too. We may have walked in the door and been rushed back to the OR to take over a crash c-section, had to support a family who lost their baby, you may be the third delivery of our shift, we may have not sat down for a proper meal for 12 hours, or shifts go by when we’ve literally started the day with a cup of coffee on the drive in and not had a sip of anything for the duration of the shift. So if you see us at that moment, we try not to show it but sometimes, it’s hard not to carry that weight from patient to patient. It doesn’t mean we don’t love our job, it just means we are flawed like everyone else. We love what we do!

So if you are worried about bothering us cause you are nauseous or throwing up, if you feel bad about pooping when you push, if you are nervous about holding it together on our account, I’m here to say: don’t! We have seen it all, cleaned it all, endured a lot, and yet we still *love* what we do! 

I hope this message finds anyone out there who needed to hear this. We are so excited to be a part of your labor and delivery experience! 

xo,
A L&D RN",1090,61,2020-08-29,c-section delivery,487,,,,,,,,,
